Authors,Author(s) ID,Title,Year,Source title,Volume,Issue,Art. No.,Page start,Page end,Page count,Cited by,DOI,Link,Document Type,Publication Stage,Open Access,Source,EID
"Li, C., Guo, Y., Zuo, W.","","Zero-reference deep curve estimation for low-light image enhancement",2021,"IEEE Transactions on Pattern Analysis and Machine Intelligence",,,,"","",,1,,,Article,"Final","",Scopus,2-s2.0-85214579907
"Guo, C., Li, C., Guo, J., Loy, C.C., Hou, J., Kwong, S., Cong, R.","57194397955;57149806700;7404489048;25522308800;36989331100;7005601503;56727848800;","Zero-reference deep curve estimation for low-light image enhancement",2020,"Proceedings of the IEEE Computer Society Conference on Computer Vision and Pattern Recognition",,,"9157813","1777","1786",,1403,"10.1109/CVPR42600.2020.00185","https://www.scopus.com/inward/record.uri?eid=2-s2.0-85085600049&doi=10.1109%2fCVPR42600.2020.00185&partnerID=40&md5=d6f2ab3de496c70e77407f24998215f7",Conference Paper,"Final","All Open Access, Green",Scopus,2-s2.0-85085600049
"Wang, J., Ma, L., Yu, Q.","","Nighttime light remote sensing: An overview of theory, sources, and applications",2019,"Remote Sensing","11","17",,"2019","",,1,,,Article,"Final","",Scopus,2-s2.0-85214572386
"Parihar, A.S., Singh, K.","36998900100;57202989817;","A study on Retinex based method for image enhancement",2018,"Proceedings of the 2nd International Conference on Inventive Systems and Control, ICISC 2018",,,,"619","624",,88,"10.1109/ICISC.2018.8398874","https://www.scopus.com/inward/record.uri?eid=2-s2.0-85050099499&doi=10.1109%2fICISC.2018.8398874&partnerID=40&md5=35f192a6f1b94064b576681d3c42b873",Conference Paper,"Final","",Scopus,2-s2.0-85050099499
"Elvidge, C.D., Baugh, K., Zhizhin, M., Hsu, F.C., Ghosh, T.","7004441399;6603478170;57110203600;36604501400;8983122800;","VIIRS night-time lights",2017,"International Journal of Remote Sensing","38","21",,"5860","5879",,647,"10.1080/01431161.2017.1342050","https://www.scopus.com/inward/record.uri?eid=2-s2.0-85021300522&doi=10.1080%2f01431161.2017.1342050&partnerID=40&md5=17069ab6dfa47384142455d202a159cd",Article,"Final","All Open Access, Hybrid Gold",Scopus,2-s2.0-85021300522
"Huang, X., Wu, Y., Sun, Q.","","A review of night-time light remote sensing and its applications in urban studies",2017,"Remote Sensing","9","6",,"583","",,1,,,Article,"Final","",Scopus,2-s2.0-85214585361
"Guo, L., Li, Z., Wang, J.","","Advances in low-light-level imaging sensors and their applications",2016,"Optics and Lasers in Engineering","80",,,"169","179",,1,,,Article,"Final","",Scopus,2-s2.0-85214560481
"Chen, S., Liu, H., Wang, Y.","","Low-light level imaging technology and its application in remote sensing",2015,"Journal of Infrared, Millimeter, and Terahertz Waves","36","3",,"251","265",,1,,,Article,"Final","",Scopus,2-s2.0-85214560612
"Lee, E., Kim, S., Kang, W., Seo, D., Paik, J.","55491709700;55718684800;57216482613;8209930900;7102939640;","Contrast enhancement using dominant brightness level analysis and adaptive intensity transformation for remote sensing images",2013,"IEEE Geoscience and Remote Sensing Letters","10","1",,"62","66",,81,"10.1109/LGRS.2012.2192412","https://www.scopus.com/inward/record.uri?eid=2-s2.0-84887823122&doi=10.1109%2fLGRS.2012.2192412&partnerID=40&md5=32261e9274bc197655368fe3406006da",Article,"Final","",Scopus,2-s2.0-84887823122
"Mittal, A., Moorthy, A.K., Bovik, A.C.","36728155400;26427754300;56984291600;","No-reference image quality assessment in the spatial domain",2012,"IEEE Transactions on Image Processing","21","12","6272356","4695","4708",,4463,"10.1109/TIP.2012.2214050","https://www.scopus.com/inward/record.uri?eid=2-s2.0-84869436579&doi=10.1109%2fTIP.2012.2214050&partnerID=40&md5=9ffcf8d66b027f0900f457a3f7980212",Article,"Final","All Open Access, Green",Scopus,2-s2.0-84869436579
"Jang, J.H., Kim, S.D., Ra, J.B.","57198251683;7601578947;7006884397;","Enhancement of optical remote sensing images by subband-decomposed multiscale retinex with hybrid intensity transfer function",2011,"IEEE Geoscience and Remote Sensing Letters","8","5","5783502","983","987",,75,"10.1109/LGRS.2011.2146227","https://www.scopus.com/inward/record.uri?eid=2-s2.0-80052321238&doi=10.1109%2fLGRS.2011.2146227&partnerID=40&md5=f95dfb58194a7fca038156f9e7817f92",Article,"Final","",Scopus,2-s2.0-80052321238
"Zhang, Q., Seto, K. C.","","Characterizing urban land expansion using DMSP/OLS nighttime stable lights data in China from 1992 to 2008",2011,"Remote Sensing of Environment","115","2",,"633","640",,1,,,Article,"Final","",Scopus,2-s2.0-85214570243
"Yang, Y., Newsam, S.","57192546856;57203513586;","Bag-of-visual-words and spatial extensions for land-use classification",2010,"GIS: Proceedings of the ACM International Symposium on Advances in Geographic Information Systems",,,,"270","279",,2409,"10.1145/1869790.1869829","https://www.scopus.com/inward/record.uri?eid=2-s2.0-78650593938&doi=10.1145%2f1869790.1869829&partnerID=40&md5=a67da44a969cb83958c1fb85de50c27a",Conference Paper,"Final","",Scopus,2-s2.0-78650593938
"Li, G.-Z., Luo, W.-S., Li, P.","7408458510;7202199203;57211118299;","Color image enhancement based on visual characteristics of human eyes",2009,"Guangdian Gongcheng/Opto-Electronic Engineering","36","11",,"92","95",,6,"10.3969/j.issn.1003-501X.2009.11.019","https://www.scopus.com/inward/record.uri?eid=2-s2.0-72749092418&doi=10.3969%2fj.issn.1003-501X.2009.11.019&partnerID=40&md5=5be93384c656b74190ff55d96eabcae9",Article,"Final","",Scopus,2-s2.0-72749092418
"Jaspers, C.A.M.","",[No title available],2004,"Histogram Equalization",,,,"","",,24,,,Article,"Final","",Scopus,2-s2.0-84994660900
"Farid, H.","7007029048;","Blind inverse gamma correction",2001,"IEEE Transactions on Image Processing","10","10",,"1428","1433",,288,"10.1109/83.951529","https://www.scopus.com/inward/record.uri?eid=2-s2.0-0035473763&doi=10.1109%2f83.951529&partnerID=40&md5=3b5933d99da6e61478cc4c89dc514bef",Article,"Final","",Scopus,2-s2.0-0035473763
"Zuiderveld, K.","","Contrast limited adaptive histogram equalization",1994,"Graphics Gems IV",,,,"474","485",,3066,,,Article,"Final","",Scopus,2-s2.0-0012934579
"Pizer, Stephen M., Amburn, E.Philip, Austin, John D., Cromartie, Robert, Geselowitz, Ari, Greer, Trey, ter Haar Romeny, Bart, Zimmerman, John B., Zuiderveld, Karel","7005852364;6506203653;7402093388;36764710500;6507233658;7003960874;35569046600;56220374400;6701358588;","ADAPTIVE HISTOGRAM EQUALIZATION AND ITS VARIATIONS.",1987,"Computer vision, graphics, and image processing","39","3",,"355","368",,3142,"10.1016/S0734-189X(87)80186-X","https://www.scopus.com/inward/record.uri?eid=2-s2.0-0023421339&doi=10.1016%2fS0734-189X%2887%2980186-X&partnerID=40&md5=18ac586e1f21c0424e9f6a07fd5ae3ab",Article,"Final","",Scopus,2-s2.0-0023421339
"Horn, B.K.P., Schunck, B.G.","7102426168;7004509972;","Determining optical flow",1981,"Artificial Intelligence","17","1-3",,"185","203",,6425,"10.1016/0004-3702(81)90024-2","https://www.scopus.com/inward/record.uri?eid=2-s2.0-0019597413&doi=10.1016%2f0004-3702%2881%2990024-2&partnerID=40&md5=a5bbe7b5659e044b2356afaf098de474",Article,"Final","",Scopus,2-s2.0-0019597413
