Authors,Author(s) ID,Title,Year,Source title,Volume,Issue,Art. No.,Page start,Page end,Page count,Cited by,DOI,Link,Document Type,Publication Stage,Open Access,Source,EID
"Ye, F., Zhang, L., Jia, C.","57207407665;56649874600;57189355795;","Deep Video Compression with Scaled Hierarchical Bi-directional Motion Model",2024,"MM 2024 - Proceedings of the 32nd ACM International Conference on Multimedia",,,,"11244","11247",,,"10.1145/3664647.3685524","https://www.scopus.com/inward/record.uri?eid=2-s2.0-85209773643&doi=10.1145%2f3664647.3685524&partnerID=40&md5=0238e7e8714af8161be2ec1882ae5388",Conference Paper,"Final","",Scopus,2-s2.0-85209773643
"Chandra Sekhar, M., Pattem, S., Kumar, B.S., Patnaik, S.","57656988100;58169731400;59350583400;57548967300;","EFFICIENT VIDEO COMPRESSION USING DEEP JOINT OPTIMIZATION METHOD WITH MOTION ESTIMATION AND INTER-FRAME PREDICTION",2024,"Journal of Theoretical and Applied Information Technology","102","9",,"4061","4078",,,,"https://www.scopus.com/inward/record.uri?eid=2-s2.0-85205402805&partnerID=40&md5=b6e7d06c5736b7e4a13699ab5a800e7e",Article,"Final","",Scopus,2-s2.0-85205402805
"Menapace, W., Siarohin, A., Skorokhodov, I., Deyneka, E., Chen, T.-S., Kag, A., Fang, Y., Stoliar, A., Ricci, E., Ren, J., Tulyakov, S.","57218406345;57194724858;57219794509;58912510000;58259917400;57202036238;57219638370;57397998200;14018372900;57194466391;57213004407;","Snap Video: Scaled Spatiotemporal Transformers for Text-to-Video Synthesis",2024,"Proceedings of the IEEE Computer Society Conference on Computer Vision and Pattern Recognition",,,,"7038","7048",,4,"10.1109/CVPR52733.2024.00672","https://www.scopus.com/inward/record.uri?eid=2-s2.0-85197195088&doi=10.1109%2fCVPR52733.2024.00672&partnerID=40&md5=d9ae7d503b577dfe4218aecb5ef1c482",Conference Paper,"Final","All Open Access, Green",Scopus,2-s2.0-85197195088
"Huang, C.-H., Wu, J.-L.","35210003100;7409250086;","Joint Image Data Hiding and Rate-Distortion Optimization in Neural Compressed Latent Representations",2024,"Lecture Notes in Computer Science (including subseries Lecture Notes in Artificial Intelligence and Lecture Notes in Bioinformatics)","14554 LNCS",,,"94","108",,,"10.1007/978-3-031-53305-1_8","https://www.scopus.com/inward/record.uri?eid=2-s2.0-85185711872&doi=10.1007%2f978-3-031-53305-1_8&partnerID=40&md5=c7b9370e956679e830439352670bf352",Conference Paper,"Final","",Scopus,2-s2.0-85185711872
"Khoshkhahtinat, A., Zafari, A., Mehta, P.M., Nasrabadi, N.M., Thompson, B.J., Kirk, M.S.F., Da Silva, D.","57939022000;57198320868;53664049500;7006312852;7402482786;26534497000;57203900357;","Context-Aware Neural Video Compression on Solar Dynamics Observatory",2023,"Proceedings - 22nd IEEE International Conference on Machine Learning and Applications, ICMLA 2023",,,,"667","674",,,"10.1109/ICMLA58977.2023.00098","https://www.scopus.com/inward/record.uri?eid=2-s2.0-85190108602&doi=10.1109%2fICMLA58977.2023.00098&partnerID=40&md5=43c8b7da810bb4eedddd47707c097078",Conference Paper,"Final","All Open Access, Green",Scopus,2-s2.0-85190108602
"Huang, C.-H., Wu, J.-L.","35210003100;7409250086;","Image Data Hiding in Neural Compressed Latent Representations",2023,"2023 IEEE International Conference on Visual Communications and Image Processing, VCIP 2023",,,,"","",,2,"10.1109/VCIP59821.2023.10402627","https://www.scopus.com/inward/record.uri?eid=2-s2.0-85184857333&doi=10.1109%2fVCIP59821.2023.10402627&partnerID=40&md5=1ad9b0e342d6f9b2ba60f138fdff245e",Conference Paper,"Final","All Open Access, Green",Scopus,2-s2.0-85184857333
