Authors,Author(s) ID,Title,Year,Source title,Volume,Issue,Art. No.,Page start,Page end,Page count,Cited by,DOI,Link,Document Type,Publication Stage,Open Access,Source,EID
"Karl, K.A., Peluchette, J.V., Aghakhani, N.","14319049500;6506072237;36052438800;","Virtual Work Meetings During the COVID-19 Pandemic: The Good, Bad, and Ugly",2022,"Small Group Research","53","3",,"343","365",,196,"10.1177/10464964211015286","https://www.scopus.com/inward/record.uri?eid=2-s2.0-85106706875&doi=10.1177%2f10464964211015286&partnerID=40&md5=8c2d51c8c191f985566e1485d25f3c99",Article,"Final","All Open Access, Hybrid Gold, Green",Scopus,2-s2.0-85106706875
"Hilgefort, J.M., Arp, D., Rieck, K.","57367128900;55947768800;14016551700;","Spying through Virtual Backgrounds of Video Calls",2021,"AISec 2021 - Proceedings of the 14th ACM Workshop on Artificial Intelligence and Security, co-located with CCS 2021",,,,"135","144",,7,"10.1145/3474369.3486870","https://www.scopus.com/inward/record.uri?eid=2-s2.0-85120895648&doi=10.1145%2f3474369.3486870&partnerID=40&md5=fb82fe9083ef33da618be162ae9e3fa9",Conference Paper,"Final","",Scopus,2-s2.0-85120895648
[No author name available],[No author id available],[No title available],2021,,,,,"","",,1,,,Article,"Final","",Scopus,2-s2.0-85166487298
[No author name available],[No author id available],[No title available],2021,,,,,"","",,1,,,Article,"Final","",Scopus,2-s2.0-85166486237
[No author name available],[No author id available],[No title available],2021,,,,,"","",,1,,,Article,"Final","",Scopus,2-s2.0-85166485739
[No author name available],[No author id available],[No title available],2021,,,,,"","",,1,,,Article,"Final","",Scopus,2-s2.0-85166484885
[No author name available],[No author id available],[No title available],2021,,,,,"","",,1,,,Article,"Final","",Scopus,2-s2.0-85166482655
[No author name available],[No author id available],[No title available],2021,,,,,"","",,1,,,Article,"Final","",Scopus,2-s2.0-85166478382
[No author name available],[No author id available],[No title available],2021,,,,,"","",,1,,,Article,"Final","",Scopus,2-s2.0-85166477699
[No author name available],[No author id available],[No title available],2021,,,,,"","",,1,,,Article,"Final","",Scopus,2-s2.0-85166476058
[No author name available],[No author id available],[No title available],2021,"Acer Predator 15",,,,"","",,1,,,Article,"Final","",Scopus,2-s2.0-85166475436
[No author name available],[No author id available],[No title available],2021,,,,,"","",,1,,,Article,"Final","",Scopus,2-s2.0-85166473561
"Li, M.","","I studied the fonts of the top 1000 websites",2021,"Here's What I Learned",,,,"","",,1,,,Article,"Final","",Scopus,2-s2.0-85166472021
[No author name available],[No author id available],[No title available],2021,"Alexa Seo and Competitive Analysis Software",,,,"","",,1,,,Article,"Final","",Scopus,2-s2.0-85166470607
[No author name available],[No author id available],[No title available],2021,,,,,"","",,1,,,Article,"Final","",Scopus,2-s2.0-85166470498
[No author name available],[No author id available],[No title available],2021,"Web Style Sheets Css Tips &amp; Tricks: Em",,,,"","",,1,,,Article,"Final","",Scopus,2-s2.0-85166469113
[No author name available],[No author id available],[No title available],2021,,,,,"","",,1,,,Article,"Final","",Scopus,2-s2.0-85166466825
[No author name available],[No author id available],[No title available],2021,,,,,"","",,1,,,Article,"Final","",Scopus,2-s2.0-85166466482
"Ding, K., Ma, K., Wang, S., Simoncelli, E.P.","","Image quality assessment: Unifying structure and texture similarity",2020,"Image quality assessment: Unifying structure and texture similarity",,,,"","",,44,,,Article,"Final","",Scopus,2-s2.0-85147657052
"Arntz, M., Ben Yahmed, S., Berlingieri, F.","15018946100;57192314548;57668541900;","Working from Home and COVID-19: The Chances and Risks for Gender Gaps",2020,"Intereconomics","55","6",,"381","386",,103,"10.1007/s10272-020-0938-5","https://www.scopus.com/inward/record.uri?eid=2-s2.0-85096916714&doi=10.1007%2fs10272-020-0938-5&partnerID=40&md5=21061f1679d4a2d1e9f330a64dd8bbf7",Article,"Final","All Open Access, Hybrid Gold, Green",Scopus,2-s2.0-85096916714
"Schott, AG.","",[No title available],2020,"Transmittance of optical glass",,,,"","",,2,,,Article,"Final","",Scopus,2-s2.0-85116774464
[No author name available],[No author id available],[No title available],2020,"The Most Maddening Part about Working from Home: Video Conferences",,,,"","",,1,,,Article,"Final","",Scopus,2-s2.0-85166469385
"Sabra, M., Maiti, A., Jadliwala, M.","",[No title available],2020,"Zoom on the Keystrokes: Exploiting Video Calls for Keystroke Inference Attacks",,,,"","",,8,,,Article,"Final","",Scopus,2-s2.0-85109719883
"Bolton, C., Fu, K., Hester, J., Han, J.","57188761807;18434230000;55973287400;56170952600;","How to curtail oversensing in the home",2020,"Communications of the ACM","63","6",,"20","24",,3,"10.1145/336261","https://www.scopus.com/inward/record.uri?eid=2-s2.0-85085386120&doi=10.1145%2f336261&partnerID=40&md5=ac836968c2cc9c392c73465d99eab244",Article,"Final","",Scopus,2-s2.0-85085386120
"Bick, A., Blandin, A., Mertens, K.","","Work from Home After the COVID-19 Outbreak",2020,"CEPR Discussion Papers 15000",,,,"","",,12,,,Article,"Final","",Scopus,2-s2.0-85101405608
[No author name available],[No author id available],"Cisco Annual Internet Report (2018–2023)",2020,"Cisco Annual Internet Report (2018-2023)",,,,"","",,1487,,,Article,"Final","",Scopus,2-s2.0-85084148236
"Cecconello, S., Compagno, A., Conti, M., Lain, D., Tsudik, G.","57195394930;56109371100;15019127200;57189217169;7004311280;","Skype &amp; type: Keyboard eavesdropping in voice-over-IP",2019,"ACM Transactions on Privacy and Security","22","4","24","","",,8,"10.1145/3365366","https://www.scopus.com/inward/record.uri?eid=2-s2.0-85076998082&doi=10.1145%2f3365366&partnerID=40&md5=e7be7d30ea1f7f5b572e2b4cf3e15369",Article,"Final","",Scopus,2-s2.0-85076998082
"Shumailov, I., Simon, L., Yan, J., Anderson, R.","",[No title available],2019,"Hearing Your Touch: A New Acoustic Side Channel on Smartphones",,,,"","",,35,,,Article,"Final","",Scopus,2-s2.0-85079721985
"Genkin, D., Pattani, M., Schuster, R., Tromer, E.","36135431800;57211190390;57190396604;56107482300;","Synesthesia: Detecting screen content via remote acoustic side channels",2019,"Proceedings - IEEE Symposium on Security and Privacy","2019-May",,"8835386","853","869",,47,"10.1109/SP.2019.00074","https://www.scopus.com/inward/record.uri?eid=2-s2.0-85072913237&doi=10.1109%2fSP.2019.00074&partnerID=40&md5=5a10e616828b60099d6ec03a212364e5",Conference Paper,"Final","All Open Access, Bronze, Green",Scopus,2-s2.0-85072913237
"Palavets, T., Rosenfield, M.","57205240979;7006885681;","Blue-blocking Filters and Digital Eyestrain",2019,"Optometry and Vision Science","96","1",,"48","54",,33,"10.1097/OPX.0000000000001318","https://www.scopus.com/inward/record.uri?eid=2-s2.0-85059238181&doi=10.1097%2fOPX.0000000000001318&partnerID=40&md5=afab196596c906f1a39d4378643e87f6",Article,"Final","",Scopus,2-s2.0-85059238181
"Kulkarni, R.","","A Million News Headlines",2018,"A Million News Headlines",,,,"","",,32,,,Article,"Final","",Scopus,2-s2.0-85070256802
"Elble, R.J.","","Tremor",2017,"Neuro-geriatrics",,,,"311","326",,24,,,Article,"Final","",Scopus,2-s2.0-85058367963
"Compagno, A., Conti, M., Lain, D., Tsudik, G.","56109371100;15019127200;57189217169;7004311280;","Don't skype &amp; type! Acoustic eavesdropping in voice-over-IP",2017,"ASIA CCS 2017 - Proceedings of the 2017 ACM Asia Conference on Computer and Communications Security",,,,"703","715",,42,"10.1145/3052973.3053005","https://www.scopus.com/inward/record.uri?eid=2-s2.0-85021903769&doi=10.1145%2f3052973.3053005&partnerID=40&md5=634c8fe91efa9fb45423a9572e5d9dc1",Conference Paper,"Final","",Scopus,2-s2.0-85021903769
"Elble, R.J., Hellriegel, H., Raethjen, J., Deuschl, G.","7004503339;36967471800;6602316004;56881740400;","Assessment of Head Tremor with Accelerometers Versus Gyroscopic Transducers",2017,"Movement Disorders Clinical Practice","4","2",,"205","211",,26,"10.1002/mdc3.12379","https://www.scopus.com/inward/record.uri?eid=2-s2.0-85042735142&doi=10.1002%2fmdc3.12379&partnerID=40&md5=a70ac5b0ee3e85d853e7b2e6023507dd",Article,"Final","All Open Access, Bronze, Green",Scopus,2-s2.0-85042735142
"Yang, J., Huang, T.","24829720500;35513984600;","Image super-resolution: Historical overview and future challenges",2017,"Super-Resolution Imaging",,,,"1","33",,29,"10.1201/9781439819319","https://www.scopus.com/inward/record.uri?eid=2-s2.0-85052484789&doi=10.1201%2f9781439819319&partnerID=40&md5=7fb0d1b9fda6124ccceaf52a6b6569a7",Book Chapter,"Final","All Open Access, Green",Scopus,2-s2.0-85052484789
[No author name available],[No author id available],[No title available],2016,"Approximate Focal Length for Webcams and Cell Phone Cameras",,,,"","",,1,,,Article,"Final","",Scopus,2-s2.0-85166468551
"Holden, B.A., Fricke, T.R., Wilson, D.A., Jong, M., Naidoo, K.S., Sankaridurg, P., Wong, T.Y., Naduvilath, T.J., Resnikoff, S.","7005410826;7003797961;56420515100;56039516200;35564549000;6701829390;7403147159;7004632781;7006012071;","Global Prevalence of Myopia and High Myopia and Temporal Trends from 2000 through 2050",2016,"Ophthalmology","123","5",,"1036","1042",,3404,"10.1016/j.ophtha.2016.01.006","https://www.scopus.com/inward/record.uri?eid=2-s2.0-84963943910&doi=10.1016%2fj.ophtha.2016.01.006&partnerID=40&md5=26eb1979adba093ae7ccdce95f8b05cc",Article,"Final","All Open Access, Hybrid Gold, Green",Scopus,2-s2.0-84963943910
[No author name available],[No author id available],[No title available],2015,"Webcam Field of View",,,,"","",,1,,,Article,"Final","",Scopus,2-s2.0-85166485914
"Juarez, M., Afroz, S., Acar, G., Diaz, C., Greenstadt, R.","55630224200;35301713700;55949029400;22333378700;6507890102;","A critical evaluation of website fingerprinting attacks",2014,"Proceedings of the ACM Conference on Computer and Communications Security",,,,"263","274",,229,"10.1145/2660267.2660368","https://www.scopus.com/inward/record.uri?eid=2-s2.0-84910669063&doi=10.1145%2f2660267.2660368&partnerID=40&md5=db8a5211ffdcaa2b812e85ff5101e341",Conference Paper,"Final","",Scopus,2-s2.0-84910669063
[No author name available],[No author id available],[No title available],2013,"Converting Diagonal Field of View and Aspect Ratio to Horizontal and Vertical Field of View",,,,"","",,1,,,Article,"Final","",Scopus,2-s2.0-85166475453
"Elibol, F., Sarac, U., Erer, I.","55498041800;57219190497;6603348002;","Realistic eavesdropping attacks on computer displays with low-cost and mobile receiver system",2012,"European Signal Processing Conference",,,"6334179","1767","1771",,40,,"https://www.scopus.com/inward/record.uri?eid=2-s2.0-84869805191&partnerID=40&md5=13093c7e9c183c31b53943a6d4f9fef3",Conference Paper,"Final","",Scopus,2-s2.0-84869805191
"Lindeberg, T.","","Scale invariant feature transform",2012,"Scale Invariant Feature Transform",,,,"","",,120,,,Article,"Final","",Scopus,2-s2.0-84882272627
"Zhang, L., Zhang, L., Mou, X., Zhang, D.","54796088600;55115873800;7003389599;57195047946;","FSIM: A feature similarity index for image quality assessment",2011,"IEEE Transactions on Image Processing","20","8","5705575","2378","2386",,4372,"10.1109/TIP.2011.2109730","https://www.scopus.com/inward/record.uri?eid=2-s2.0-79960509746&doi=10.1109%2fTIP.2011.2109730&partnerID=40&md5=ebb899ded1e292201c1754e1442463f9",Article,"Final","All Open Access, Green",Scopus,2-s2.0-79960509746
"Weinberg, Z., Chen, E.Y., Jayaraman, P.R., Jackson, C.","36669515500;57192707381;48361345200;55057754600;","I still know what you visited last summer: Leaking browsing history via user interaction and side channel attacks",2011,"Proceedings - IEEE Symposium on Security and Privacy",,,"5958027","147","161",,89,"10.1109/SP.2011.23","https://www.scopus.com/inward/record.uri?eid=2-s2.0-80051955689&doi=10.1109%2fSP.2011.23&partnerID=40&md5=74a63ee858b4f5d1d980a0c4d802ba3c",Conference Paper,"Final","",Scopus,2-s2.0-80051955689
"Islam, M.M., Asari, V.K., Islam, M.N., Karim, M.A.","57225862352;6701420692;57218348877;7202145402;","Video super-resolution by adaptive kernel regression",2009,"Lecture Notes in Computer Science (including subseries Lecture Notes in Artificial Intelligence and Lecture Notes in Bioinformatics)","5876 LNCS","PART 2",,"799","806",,6,"10.1007/978-3-642-10520-3_76","https://www.scopus.com/inward/record.uri?eid=2-s2.0-72449155659&doi=10.1007%2f978-3-642-10520-3_76&partnerID=40&md5=eef0351c51aeb67ef883a82753d31539",Conference Paper,"Final","",Scopus,2-s2.0-72449155659
"Backes, M., Chen, T., Dürmuth, M., Lensch, H.P.A., Welk, M.","6603696569;15623286000;9533003600;6602401986;22433971300;","Tempest in a teapot: Compromising reflections revisited",2009,"Proceedings - IEEE Symposium on Security and Privacy",,,"5207653","315","327",,70,"10.1109/SP.2009.20","https://www.scopus.com/inward/record.uri?eid=2-s2.0-70449642762&doi=10.1109%2fSP.2009.20&partnerID=40&md5=4b12b002756a59894f8d8160fa069948",Conference Paper,"Final","",Scopus,2-s2.0-70449642762
"Sampat, M.P., Wang, Z., Gupta, S., Bovik, A.C., Markey, M.K.","6604030129;55880038400;56734810100;56984291600;6603811558;","Complex wavelet structural similarity: A new image similarity index",2009,"IEEE Transactions on Image Processing","18","11",,"2385","2401",,553,"10.1109/TIP.2009.2025923","https://www.scopus.com/inward/record.uri?eid=2-s2.0-70350580467&doi=10.1109%2fTIP.2009.2025923&partnerID=40&md5=4f9bb96f8ac468d7991b239211a08ee5",Article,"Final","",Scopus,2-s2.0-70350580467
"Backes, M., Dürmuth, M., Unruh, D.","6603696569;9533003600;56232421700;","Compromising reflections - Or - How to read LCD monitors around the corner",2008,"Proceedings - IEEE Symposium on Security and Privacy",,,"4531151","158","169",,87,"10.1109/SP.2008.25","https://www.scopus.com/inward/record.uri?eid=2-s2.0-50249171782&doi=10.1109%2fSP.2008.25&partnerID=40&md5=11d27dcd506c2039ecd765422c4702db",Conference Paper,"Final","",Scopus,2-s2.0-50249171782
"Arditi, A., Cho, J.","57207554001;8920964000;","Serifs and font legibility",2005,"Vision Research","45","23",,"2926","2933",,115,"10.1016/j.visres.2005.06.013","https://www.scopus.com/inward/record.uri?eid=2-s2.0-24944450691&doi=10.1016%2fj.visres.2005.06.013&partnerID=40&md5=02add37837766f64186bf89a0412b1bf",Article,"Final","All Open Access, Green",Scopus,2-s2.0-24944450691
"Kuhn, M.G.","55629274500;","Security limits for compromising emanations",2005,"Lecture Notes in Computer Science","3659",,,"265","279",,67,"10.1007/11545262_20","https://www.scopus.com/inward/record.uri?eid=2-s2.0-27244450325&doi=10.1007%2f11545262_20&partnerID=40&md5=6a8d521351fff8a6f3a1faa4340b5c01",Conference Paper,"Final","All Open Access, Bronze",Scopus,2-s2.0-27244450325
"Farsiu, S., Robinson, M.D., Elad, M., Milanfar, P.","6603132896;56035934900;7003845289;7004264375;","Fast and robust multiframe super resolution",2004,"IEEE Transactions on Image Processing","13","10",,"1327","1344",,1994,"10.1109/TIP.2004.834669","https://www.scopus.com/inward/record.uri?eid=2-s2.0-4544374765&doi=10.1109%2fTIP.2004.834669&partnerID=40&md5=3d02d9e9373ee04aa379408f37c6edbb",Article,"Final","",Scopus,2-s2.0-4544374765
"Kuo, C.-H., Ye, Z.","7404481108;7401956733;","Sonic crystal lenses that obey the lensmaker's formula",2004,"Journal of Physics D: Applied Physics","37","15",,"2155","2159",,23,"10.1088/0022-3727/37/15/017","https://www.scopus.com/inward/record.uri?eid=2-s2.0-3843065500&doi=10.1088%2f0022-3727%2f37%2f15%2f017&partnerID=40&md5=ae967510b4b5e4adbbcef297c4021951",Article,"Final","All Open Access, Green",Scopus,2-s2.0-3843065500
"Kuhn, M.G.","","Electromagnetic eavesdropping risks of flat-panel displays",2004,"4th Workshop on Privacy Enhancing Technologies",,,,"1","20",,82,,,Article,"Final","",Scopus,2-s2.0-56749102384
"Arditi, A.","57207554001;","Adjustable typography: An approach to enhancing low vision text accessibility",2004,"Ergonomics","47","5",,"469","482",,38,"10.1080/0014013031000085680","https://www.scopus.com/inward/record.uri?eid=2-s2.0-1842689302&doi=10.1080%2f0014013031000085680&partnerID=40&md5=bbf2b4ea395124c7ae88f64f016db2c5",Article,"Final","",Scopus,2-s2.0-1842689302
"Wang, Z., Bovik, A.C., Sheikh, H.R., Simoncelli, E.P.","55880038400;56984291600;7006576714;7004044833;","Image quality assessment: From error visibility to structural similarity",2004,"IEEE Transactions on Image Processing","13","4",,"600","612",,43470,"10.1109/TIP.2003.819861","https://www.scopus.com/inward/record.uri?eid=2-s2.0-1942436689&doi=10.1109%2fTIP.2003.819861&partnerID=40&md5=c5daf1e844ae994c5641935ce4d84b4c",Article,"Final","",Scopus,2-s2.0-1942436689
"Higashiyama, A., Yokoyama, Y., Shimono, K.","7004181647;7402993815;7004820378;","Perceived distance of targets in convex mirrors",2001,"Japanese Psychological Research","43","1",,"13","24",,11,"10.1111/1468-5884.00155","https://www.scopus.com/inward/record.uri?eid=2-s2.0-0035582365&doi=10.1111%2f1468-5884.00155&partnerID=40&md5=611e7f9f9119fdf8ec5ed600a9c11ab6",Article,"Final","",Scopus,2-s2.0-0035582365
"van Eck, W.","6603397344;","Electromagnetic radiation from video display units: An eavesdropping risk?",1985,"Computers and Security","4","4",,"269","286",,424,"10.1016/0167-4048(85)90046-X","https://www.scopus.com/inward/record.uri?eid=2-s2.0-0022218742&doi=10.1016%2f0167-4048%2885%2990046-X&partnerID=40&md5=edec11377ca42ad6c9b671ce81c7bd9f",Article,"Final","All Open Access, Green",Scopus,2-s2.0-0022218742
"Saltzer, J.H., Schroeder, M.D.","6602117301;7202239455;","The Protection of Information in Computer Systems",1975,"Proceedings of the IEEE","63","9",,"1278","1308",,1475,"10.1109/PROC.1975.9939","https://www.scopus.com/inward/record.uri?eid=2-s2.0-0016555241&doi=10.1109%2fPROC.1975.9939&partnerID=40&md5=5d6b6ccc6f5539b6f917639fca247152",Article,"Final","",Scopus,2-s2.0-0016555241
"Deng, Z., Morissette, R., Messacar, D.","","Running the Economy Remotely: Potential for Working From Home during and after COVID-19",0000,"Statistics Canada Catalogue",,,,"","",,8,,,Article,"Final","",Scopus,2-s2.0-85090895647
