Authors,Author(s) ID,Title,Year,Source title,Volume,Issue,Art. No.,Page start,Page end,Page count,Cited by,DOI,Link,Document Type,Publication Stage,Open Access,Source,EID
"Oum, W., Mirzaei, A., Shin, K.Y., Kim, E.B., Kim, H.M., Kim, S.S., Kim, H.W.","57202378935;57196467909;57219412139;57729635300;59283438500;57063840100;35324882800;","Xe+ ion irradiation to boost NO2 sensing characteristics of SnO2 nanowires",2023,"Sensors and Actuators B: Chemical","393",,"134206","","",,8,"10.1016/j.snb.2023.134206","https://www.scopus.com/inward/record.uri?eid=2-s2.0-85163187838&doi=10.1016%2fj.snb.2023.134206&partnerID=40&md5=6b90487f8ac482cecce452962a3bde6d",Article,"Final","",Scopus,2-s2.0-85163187838
"Chen, Z., Fu, F., Cao, J., An, L., Zhang, K., Chen, Q.","57416773600;57212529014;57188769936;58192526900;58192217800;58192369900;","Study on gas sensitivity of ZnO@NiO loaded functional carbon materials",2023,"Materials Research Bulletin","165",,"112298","","",,2,"10.1016/j.materresbull.2023.112298","https://www.scopus.com/inward/record.uri?eid=2-s2.0-85153209855&doi=10.1016%2fj.materresbull.2023.112298&partnerID=40&md5=92603da3c6af6ba7692f6b78e71a1d97",Article,"Final","",Scopus,2-s2.0-85153209855
"Mathankumar, G., Harish, S., Mohan, M.K., Bharathi, P., Kannan, S.K., Archana, J., Navaneethan, M.","57211027979;24331123500;52063550300;58888852300;57221929888;26653958300;57729816700;","Enhanced selectivity and ultra-fast detection of NO2 gas sensor via Ag modified WO3 nanostructures for gas sensing applications",2023,"Sensors and Actuators B: Chemical","381",,"133374","","",,42,"10.1016/j.snb.2023.133374","https://www.scopus.com/inward/record.uri?eid=2-s2.0-85147581829&doi=10.1016%2fj.snb.2023.133374&partnerID=40&md5=1516d0032c7bbf91bb5b792c7a276c9f",Article,"Final","",Scopus,2-s2.0-85147581829
"Agarwal, R., Singh, S., Shalan, A.E.","58068337600;57214304600;55175063200;","Sustainable energy storage devices and device design for sensors and actuators applications",2023,"Sustainable Energy Storage in the Scope of Circular Economy: Advanced Materials and Device Design",,,,"225","290",,13,"10.1002/9781119817741.ch10","https://www.scopus.com/inward/record.uri?eid=2-s2.0-85175480437&doi=10.1002%2f9781119817741.ch10&partnerID=40&md5=2d4f6f473f1061b07d0905b335db98f7",Book Chapter,"Final","",Scopus,2-s2.0-85175480437
"Saggu, I.S., Singh, S., Chen, K., Xuan, Z., Swihart, M.T., Sharma, S.","57817873500;57201871255;57810813400;57219625255;7004029171;58816455700;","Ultrasensitive Room-Temperature NO2Detection Using SnS2/MWCNT Composites and Accelerated Recovery Kinetics by UV Activation",2023,"ACS Sensors","8","1",,"243","253",,27,"10.1021/acssensors.2c02104","https://www.scopus.com/inward/record.uri?eid=2-s2.0-85146592165&doi=10.1021%2facssensors.2c02104&partnerID=40&md5=26a8382984c37d698fce8c13a78922c9",Article,"Final","",Scopus,2-s2.0-85146592165
"Rao, V.N., Sairam, P.K., Kim, M.D.","","CdS/TiO 2 nano hybrid heterostructured materials for superior hydrogen production and gas sensor applications",2023,"J. Environ. Manag.","340",,,"15","",,1,,,Article,"Final","",Scopus,2-s2.0-85182164680
"Hang, N., Hieu, N.H., Nhiem, L.T.","58065613200;57023533100;57023904700;","Sensitive NO2 sensor based on silver nanowires-decorated monolayer graphene with assistance of UV illumination",2023,"Journal of Materials Science: Materials in Electronics","34","2","90","","",,4,"10.1007/s10854-022-09507-9","https://www.scopus.com/inward/record.uri?eid=2-s2.0-85146301332&doi=10.1007%2fs10854-022-09507-9&partnerID=40&md5=d1db570a1635cd7cc63522223989ae0f",Article,"Final","",Scopus,2-s2.0-85146301332
"Basivi, P.K., Pasupuleti, K.S., Gelija, D., Kim, M.-D., Pasupuleti, V.R., Kim, C.W.","57195060987;57219936688;57200322478;24577628800;55904825600;34770393500;","UV-light-enhanced room temperature NO2 gas-sensing performances based on sulfur-doped graphitic carbon nitride nanoflakes",2022,"New Journal of Chemistry","46","40",,"19254","19262",,19,"10.1039/d2nj04117k","https://www.scopus.com/inward/record.uri?eid=2-s2.0-85140462157&doi=10.1039%2fd2nj04117k&partnerID=40&md5=d7ff4b887d7300774fdb79e7be3c4b77",Article,"Final","",Scopus,2-s2.0-85140462157
"Awan, A., Baig, A., Zubair, M., Rahdar, A., Nazar, M.F., Farooqi, A.S., Shalan, A.E., Lanceros-Méndez, S., Zafar, M.N.","57222039015;58706949800;58120805400;36599143100;24759084400;57192915161;55175063200;57211501457;55584792053;","Green synthesis of molybdenum-based nanoparticles and their applications in energy conversion and storage: A review",2022,"International Journal of Hydrogen Energy","47","72",,"31014","31057",,36,"10.1016/j.ijhydene.2021.10.076","https://www.scopus.com/inward/record.uri?eid=2-s2.0-85119084393&doi=10.1016%2fj.ijhydene.2021.10.076&partnerID=40&md5=60aed3634fec3b64b4a2d6ea63859e6b",Article,"Final","",Scopus,2-s2.0-85119084393
"Liu, Y., Zhang, J., Li, G., Liu, J., Liang, Q., Wang, H., Zhu, Y., Gao, J., Lu, H.","57218772551;57189714065;57404182800;59064676900;57210896940;55688878300;56364563900;57189711767;55729805100;","In2O3–ZnO nanotubes for the sensitive and selective detection of ppb-level NO2 under UV irradiation at room temperature",2022,"Sensors and Actuators B: Chemical","355",,"131322","","",,48,"10.1016/j.snb.2021.131322","https://www.scopus.com/inward/record.uri?eid=2-s2.0-85122207480&doi=10.1016%2fj.snb.2021.131322&partnerID=40&md5=ee8c14badc4ac137bdd30fd1d631893c",Article,"Final","",Scopus,2-s2.0-85122207480
"Li, T., Zhang, D., Pan, Q., Tang, M., Yu, S.","57196410555;57195967445;57215836362;57384667400;57209616423;","UV enhanced NO2 gas sensing at room temperature based on coral-like tin diselenide/MOFs-derived nanoflower-like tin dioxide heteronanostructures",2022,"Sensors and Actuators B: Chemical","355",,"131049","","",,55,"10.1016/j.snb.2021.131049","https://www.scopus.com/inward/record.uri?eid=2-s2.0-85121719752&doi=10.1016%2fj.snb.2021.131049&partnerID=40&md5=b19bc73e7f05e26bda6c1451c40b4552",Article,"Final","",Scopus,2-s2.0-85121719752
"Mousa, S.A., Noby, S.Z., Shalan, A.E.","57538472500;56118537600;55175063200;","Graphene and Its Nanocomposites Derivatives: Synthesis, Properties, and Their Applications in Water Treatment, Gas Sensor, and Solar Cell Fields",2022,"Engineering Materials",,,,"95","128",,6,"10.1007/978-3-030-94319-6_5","https://www.scopus.com/inward/record.uri?eid=2-s2.0-85126651076&doi=10.1007%2f978-3-030-94319-6_5&partnerID=40&md5=a1758a2f96c96fe66f46c3b5214551a9",Book Chapter,"Final","",Scopus,2-s2.0-85126651076
"Hou, J.-L., Hsueh, T.-J.","55507210300;9336934600;","Temperature-Dependent n-Type and p-Type Sensing Behaviors of CuO Nanosheets/MEMS to NO2Gas",2021,"ACS Applied Electronic Materials","3","11",,"4817","4823",,16,"10.1021/acsaelm.1c00684","https://www.scopus.com/inward/record.uri?eid=2-s2.0-85118619203&doi=10.1021%2facsaelm.1c00684&partnerID=40&md5=5e23ad6b05f044b75e4430f29d0c5359",Article,"Final","",Scopus,2-s2.0-85118619203
"Wang, M., Zhu, Y., Luo, Q., Ge, C., Liu, G., Qiao, G., Kim, E.J.","14424656400;57226357544;57203118958;57201133464;16028889700;22635602000;26643224100;","Below-room-temperature solution-grown ZnO porous nanosheet arrays with ppb-level NO2 sensitivity under intermittent UV irradiation",2021,"Applied Surface Science","566",,"150750","","",,36,"10.1016/j.apsusc.2021.150750","https://www.scopus.com/inward/record.uri?eid=2-s2.0-85111283618&doi=10.1016%2fj.apsusc.2021.150750&partnerID=40&md5=3ffa0c2694d54aaaa6fb4231364dfdc5",Article,"Final","",Scopus,2-s2.0-85111283618
"Hung, N.M., Hung, C.M., Duy, N.V., Hoa, N.D., Hong, H.S., Dang, T.K., Viet, N.N., Thong, L.V., Phuoc, P.H., Van Hieu, N.","57215027921;57190213388;16053717800;13105338900;57956330600;57223039820;55322203500;57219977716;57214802092;37063946700;","Significantly enhanced NO2 gas-sensing performance of nanojunction-networked SnO2 nanowires by pulsed UV-radiation",2021,"Sensors and Actuators, A: Physical","327",,"112759","","",,40,"10.1016/j.sna.2021.112759","https://www.scopus.com/inward/record.uri?eid=2-s2.0-85104653632&doi=10.1016%2fj.sna.2021.112759&partnerID=40&md5=07c677d50bf616cb752878c5118a8b11",Article,"Final","",Scopus,2-s2.0-85104653632
"Chen, X., Hu, J., Chen, P., Yin, M., Meng, F., Zhang, Y.","57222713252;57209556564;57222714939;57214075183;57226574845;56320006400;","UV-light-assisted NO2 gas sensor based on WS2/PbS heterostructures with full recoverability and reliable anti-humidity ability",2021,"Sensors and Actuators, B: Chemical","339",,"129902","","",,120,"10.1016/j.snb.2021.129902","https://www.scopus.com/inward/record.uri?eid=2-s2.0-85103770264&doi=10.1016%2fj.snb.2021.129902&partnerID=40&md5=9b3289ae842623412cf1470e66338c32",Article,"Final","",Scopus,2-s2.0-85103770264
"Liang, J., Lou, Q., Wu, W., Wang, K., Xuan, C.","14829251000;57226081794;57752422200;57226078130;57226088256;","NO2Gas Sensing Performance of a VO2(B) Ultrathin Vertical Nanosheet Array: Experimental and DFT Investigation",2021,"ACS Applied Materials and Interfaces","13","27",,"31968","31977",,43,"10.1021/acsami.1c05251","https://www.scopus.com/inward/record.uri?eid=2-s2.0-85110323755&doi=10.1021%2facsami.1c05251&partnerID=40&md5=4c11feff595cdfc3e4fcd275832026a9",Article,"Final","",Scopus,2-s2.0-85110323755
"Eom, T.H., Cho, S.H., Suh, J.M., Kim, T., Lee, T.H., Jun, S.E., Yang, J.W., Lee, J., Hong, S.-H., Jang, H.W.","57219858162;56764890100;57189456664;55645851600;57192164205;57215424216;57220066613;58602867900;13307589200;7202135252;","Substantially improved room temperature NO2sensing in 2-dimensional SnS2nanoflowers enabled by visible light illumination",2021,"Journal of Materials Chemistry A","9","18",,"11168","11178",,93,"10.1039/d1ta00953b","https://www.scopus.com/inward/record.uri?eid=2-s2.0-85105700810&doi=10.1039%2fd1ta00953b&partnerID=40&md5=5feff9436b983a98d908cacbacf743ae",Article,"Final","",Scopus,2-s2.0-85105700810
"Zhao, S., Shen, Y., Maboudian, R., Carraro, C., Han, C., Liu, W., Wei, D.","57045075400;16310415400;7006616139;22960047900;54782494300;20435823300;8928507100;","Facile synthesis of ZnO-SnO2 hetero-structured nanowires for high-performance NO2 sensing application",2021,"Sensors and Actuators, B: Chemical","333",,"129613","","",,72,"10.1016/j.snb.2021.129613","https://www.scopus.com/inward/record.uri?eid=2-s2.0-85100675914&doi=10.1016%2fj.snb.2021.129613&partnerID=40&md5=af89fe010eda020d46d449dd97c5fb28",Article,"Final","All Open Access, Bronze",Scopus,2-s2.0-85100675914
"Chavez, D., Gomez-Solis, C., Mtz-Enriquez, A.I., Rodriguez-Gonzalez, V., Escobar-Barrios, V., Garcia, C.R., Oliva, J.","57208002887;55144001300;57214334040;57204665220;7801666673;56528801800;57565073100;","High sensitivity of flexible graphene composites decorated with V2O5 microbelts for NO2 detection",2021,"Materials Research Bulletin","133",,"111052","","",,19,"10.1016/j.materresbull.2020.111052","https://www.scopus.com/inward/record.uri?eid=2-s2.0-85089818609&doi=10.1016%2fj.materresbull.2020.111052&partnerID=40&md5=63c89b64c998ff664fb75781a9f58bbd",Article,"Final","All Open Access",Scopus,2-s2.0-85089818609
"Kumar, R., Liu, X., Zhang, J., Kumar, M.","57225160654;23018971600;57892127100;57714239000;","Room-Temperature Gas Sensors Under Photoactivation: From Metal Oxides to 2D Materials",2020,"Nano-Micro Letters","12","1","164","","",,270,"10.1007/s40820-020-00503-4","https://www.scopus.com/inward/record.uri?eid=2-s2.0-85089387349&doi=10.1007%2fs40820-020-00503-4&partnerID=40&md5=a77b8b04fddf5105bc71d6e404dba47a",Review,"Final","All Open Access, Gold, Green",Scopus,2-s2.0-85089387349
"Zheng, W., Xu, Y., Zheng, L., Yang, C., Pinna, N., Liu, X., Zhang, J.","56491945600;57195928109;57200960381;59046004600;6602131976;23018971600;57892127100;","MoS2 Van der Waals p–n Junctions Enabling Highly Selective Room-Temperature NO2 Sensor",2020,"Advanced Functional Materials","30","19","2000435","","",,228,"10.1002/adfm.202000435","https://www.scopus.com/inward/record.uri?eid=2-s2.0-85081409318&doi=10.1002%2fadfm.202000435&partnerID=40&md5=0287d390795175a70862e66e8906923b",Article,"Final","",Scopus,2-s2.0-85081409318
"Mounasamy, V., Mani, G.K., Madanagurusamy, S.","57201655744;56702300700;56962778100;","Vanadium oxide nanostructures for chemiresistive gas and vapour sensing: a review on state of the art",2020,"Microchimica Acta","187","4","253","","",,74,"10.1007/s00604-020-4182-2","https://www.scopus.com/inward/record.uri?eid=2-s2.0-85082792699&doi=10.1007%2fs00604-020-4182-2&partnerID=40&md5=c666c081ce244592b7b12891c0874f8a",Review,"Final","",Scopus,2-s2.0-85082792699
"Gu, D., Wang, X., Liu, W., Li, X., Lin, S., Wang, J., Rumyantseva, M.N., Gaskov, A.M., Akbar, S.A.","57192702077;55841979000;57672448500;8241588400;55537322900;56461469000;7004200807;6603869165;35564000200;","Visible-light activated room temperature NO2 sensing of SnS2 nanosheets based chemiresistive sensors",2020,"Sensors and Actuators, B: Chemical","305",,"127455","","",,138,"10.1016/j.snb.2019.127455","https://www.scopus.com/inward/record.uri?eid=2-s2.0-85076233912&doi=10.1016%2fj.snb.2019.127455&partnerID=40&md5=5fd5aeccb28fc46b95e34d202336d1ed",Article,"Final","",Scopus,2-s2.0-85076233912
"Wang, H., Zhou, L., Liu, Y., Liu, F., Liang, X., Liu, F., Gao, Y., Yan, X., Lu, G.","57220118796;57202870330;57202815168;8521236700;17342379500;56502547500;56202443400;36602024200;7403460117;","UV-activated ultrasensitive and fast reversible ppb NO2 sensing based on ZnO nanorod modified by constructing interfacial electric field with In2O3 nanoparticles",2020,"Sensors and Actuators, B: Chemical","305",,"127498","","",,74,"10.1016/j.snb.2019.127498","https://www.scopus.com/inward/record.uri?eid=2-s2.0-85075910281&doi=10.1016%2fj.snb.2019.127498&partnerID=40&md5=2528fbe6bff273578b61eefec9189fc9",Article,"Final","",Scopus,2-s2.0-85075910281
"Li, W., Guo, J., Cai, L., Qi, W., Sun, Y., Xu, J.-L., Sun, M., Zhu, H., Xiang, L., Xie, D., Ren, T.","57215044158;57195233099;8856927000;57208163723;56564355800;55236591500;57190373981;56190030000;56039404000;7202588359;7102170540;","UV light irradiation enhanced gas sensor selectivity of NO2 and SO2 using rGO functionalized with hollow SnO2 nanofibers",2019,"Sensors and Actuators, B: Chemical","290",,,"443","452",,128,"10.1016/j.snb.2019.03.133","https://www.scopus.com/inward/record.uri?eid=2-s2.0-85063985557&doi=10.1016%2fj.snb.2019.03.133&partnerID=40&md5=7674ef305483253f994ed7294f18a28d",Article,"Final","",Scopus,2-s2.0-85063985557
"Zhang, Q., Chen, C., Liu, Y., Pan, H., Du, H., Su, Y., Tai, H., Xie, G., Xu, M., Du, X.","57188821209;57213375648;57200030748;58953102200;56799646500;55693603500;14628002300;14627940500;56809889500;55635050300;","Improved response/recovery speeds of ZnO nanoparticle-based sensor toward NO2 gas under UV irradiation induced by surface oxygen vacancies",2019,"Journal of Materials Science: Materials in Electronics","30","12",,"11395","11403",,20,"10.1007/s10854-019-01488-6","https://www.scopus.com/inward/record.uri?eid=2-s2.0-85067063063&doi=10.1007%2fs10854-019-01488-6&partnerID=40&md5=951de9acf47d18fbe6c1051a4a5f43d1",Article,"Final","All Open Access, Bronze",Scopus,2-s2.0-85067063063
"Espid, E., Noce, A.S., Taghipour, F.","57191885746;56814737800;6602765341;","The effect of radiation parameters on the performance of photo-activated gas sensors",2019,"Journal of Photochemistry and Photobiology A: Chemistry","374",,,"95","105",,22,"10.1016/j.jphotochem.2019.01.038","https://www.scopus.com/inward/record.uri?eid=2-s2.0-85060987245&doi=10.1016%2fj.jphotochem.2019.01.038&partnerID=40&md5=ade337b3a7b1e01a2bcf227e833a3d31",Article,"Final","",Scopus,2-s2.0-85060987245
"Yin, H., Song, C., Wang, Z., Shao, H., Li, Y., Deng, H., Ma, Q., Yu, K.","42162393500;55640058300;36669531000;36440209300;55926581600;53871266000;55448249600;25635053500;","Self-assembled vanadium oxide nanoflakes for p-type ammonia sensors at room temperature",2019,"Nanomaterials","9","3","317","","",,29,"10.3390/nano9030317","https://www.scopus.com/inward/record.uri?eid=2-s2.0-85063629434&doi=10.3390%2fnano9030317&partnerID=40&md5=46b7079980682c4d692ea34ceb26ea1b",Article,"Final","All Open Access, Gold, Green",Scopus,2-s2.0-85063629434
"Reddeppa, M., Mitta, S.B., Park, B.-G., Kim, S.-G., Park, S.H., Kim, M.-D.","57151410500;56529486900;45761373500;37112351700;58105891000;24577628800;","DNA-CTMA functionalized GaN surfaces for NO2 gas sensor at room temperature under UV illumination",2019,"Organic Electronics","65",,,"334","340",,44,"10.1016/j.orgel.2018.11.038","https://www.scopus.com/inward/record.uri?eid=2-s2.0-85059304925&doi=10.1016%2fj.orgel.2018.11.038&partnerID=40&md5=d81bcfc5fdf88db370ae5e01cb0e6359",Article,"Final","",Scopus,2-s2.0-85059304925
"Wang, J., Yu, M., Li, X., Xia, Y.","57214694806;57205459270;35332295000;57188625733;","UV-enhanced NO 2 gas sensing properties of polystyrene sulfonate functionalized ZnO nanowires at room temperature",2019,"Inorganic Chemistry Frontiers","6","1",,"176","183",,26,"10.1039/c8qi01110a","https://www.scopus.com/inward/record.uri?eid=2-s2.0-85060105106&doi=10.1039%2fc8qi01110a&partnerID=40&md5=a17ae54740c31db40e73404cf5761d43",Article,"Final","",Scopus,2-s2.0-85060105106
"Liang, J., Zhao, Y., Zhu, K., Guo, J., Zhou, L.","14829251000;57194182179;57196744898;57200537548;55644751900;","Synthesis and room temperature NO2 gas sensitivity of vanadium dioxide nanowire structures by chemical vapor deposition",2019,"Thin Solid Films","669",,,"537","543",,31,"10.1016/j.tsf.2018.11.046","https://www.scopus.com/inward/record.uri?eid=2-s2.0-85057492812&doi=10.1016%2fj.tsf.2018.11.046&partnerID=40&md5=0a6e5528add4b876315d6d1a2777a243",Article,"Final","",Scopus,2-s2.0-85057492812
"Ali Haidry, A., Sun, L., Saruhan, B., Plecenik, A., Plecenik, T., Shen, H., Yao, Z.","57239940500;57196420641;7004568862;7004255616;12785734200;7404522882;8284257900;","Cost-effective fabrication of polycrystalline TiO2 with tunable n/p response for selective hydrogen monitoring",2018,"Sensors and Actuators, B: Chemical","274",,,"10","21",,34,"10.1016/j.snb.2018.07.082","https://www.scopus.com/inward/record.uri?eid=2-s2.0-85050676032&doi=10.1016%2fj.snb.2018.07.082&partnerID=40&md5=5c4fe74db49bbb01f80b654e81440f0d",Article,"Final","All Open Access, Green",Scopus,2-s2.0-85050676032
"Wu, E., Xie, Y., Yuan, B., Zhang, H., Hu, X., Liu, J., Zhang, D.","57194197866;57194198851;57203579117;57723978300;56194223200;55836974900;55609101000;","Ultrasensitive and Fully Reversible NO2 Gas Sensing Based on p-Type MoTe2 under Ultraviolet Illumination",2018,"ACS Sensors","3","9",,"1719","1726",,158,"10.1021/acssensors.8b00461","https://www.scopus.com/inward/record.uri?eid=2-s2.0-85052289809&doi=10.1021%2facssensors.8b00461&partnerID=40&md5=8a4aaf9417bb9deab014076fabfbd88b",Article,"Final","",Scopus,2-s2.0-85052289809
"Wu, T., Wang, Z., Tian, M., Miao, J., Zhang, H., Sun, J.","57200035560;57193126341;57225814889;57200013046;57200035228;55995233800;","UV excitation NO2 gas sensor sensitized by ZnO quantum dots at room temperature",2018,"Sensors and Actuators, B: Chemical","259",,,"526","531",,97,"10.1016/j.snb.2017.12.101","https://www.scopus.com/inward/record.uri?eid=2-s2.0-85038809270&doi=10.1016%2fj.snb.2017.12.101&partnerID=40&md5=b52a47897fa97251c2854b288c262160",Article,"Final","",Scopus,2-s2.0-85038809270
"Liang, J., Yang, R., Zhu, K., Hu, M.","14829251000;57169218100;57196744898;34770221700;","Room temperature acetone-sensing properties of branch-like VO2 (B)@ZnO hierarchical hetero-nanostructures",2018,"Journal of Materials Science: Materials in Electronics","29","5",,"3780","3789",,27,"10.1007/s10854-017-8313-4","https://www.scopus.com/inward/record.uri?eid=2-s2.0-85035104916&doi=10.1007%2fs10854-017-8313-4&partnerID=40&md5=cd47c06a05c5e40fd3451c21b42fec4e",Article,"Final","",Scopus,2-s2.0-85035104916
"Liang, J., Zhu, K., Yang, R., Hu, M.","14829251000;57196744898;57169218100;34770221700;","Room temperature NO2 sensing properties of Au-decorated vanadium oxide nanowires sensor",2018,"Ceramics International","44","2",,"2261","2268",,35,"10.1016/j.ceramint.2017.10.186","https://www.scopus.com/inward/record.uri?eid=2-s2.0-85033695852&doi=10.1016%2fj.ceramint.2017.10.186&partnerID=40&md5=70b6af8aff54c0a8288b8e0e9d75f5cc",Article,"Final","",Scopus,2-s2.0-85033695852
"Mounasamy, V., Mani, G.K., Ponnusamy, D., Tsuchiya, K., Prasad, A.K., Madanagurusamy, S.","57201655744;56702300700;55363192600;8569134800;55723723100;56962778100;","Template-free synthesis of vanadium sesquioxide (V2O3) nanosheets and their room-temperature sensing performance",2018,"Journal of Materials Chemistry A","6","15",,"6402","6413",,68,"10.1039/c7ta10159g","https://www.scopus.com/inward/record.uri?eid=2-s2.0-85045562767&doi=10.1039%2fc7ta10159g&partnerID=40&md5=13148967e34bf5216869c116bf718a77",Article,"Final","",Scopus,2-s2.0-85045562767
"Evans, G.P., Powell, M.J., Johnson, I.D., Howard, D.P., Bauer, D., Darr, J.A., Parkin, I.P.","56394959300;55839956500;56559457100;57190813721;57194060033;6603926697;56217400400;","Room temperature vanadium dioxide–carbon nanotube gas sensors made via continuous hydrothermal flow synthesis",2018,"Sensors and Actuators, B: Chemical","255",,,"1119","1129",,69,"10.1016/j.snb.2017.07.152","https://www.scopus.com/inward/record.uri?eid=2-s2.0-85028707309&doi=10.1016%2fj.snb.2017.07.152&partnerID=40&md5=d76739d9aff79624d588f6c41314e437",Article,"Final","All Open Access, Green",Scopus,2-s2.0-85028707309
"Li, K., Chen, L., White, S.J., Han, K., Lv, B., Bao, K., Wu, X., Gao, X., Azzi, M., Cen, K.","57191755821;7409435882;55452533300;57191754945;57191752435;57191750703;55547084400;14026924300;6603962966;35564108300;","Effect of nitrogen oxides (NO and NO2) and toluene on SO2 photooxidation, nucleation and growth: A smog chamber study",2017,"Atmospheric Research","192",,,"38","47",,40,"10.1016/j.atmosres.2017.03.017","https://www.scopus.com/inward/record.uri?eid=2-s2.0-85016289000&doi=10.1016%2fj.atmosres.2017.03.017&partnerID=40&md5=fc78cc176258b60de512256e8cca2ba0",Article,"Final","",Scopus,2-s2.0-85016289000
"Gong, B., Shi, T., Zhu, W., Liao, G., Li, X., Huang, J., Zhou, T., Tang, Z.","36883856500;7202756528;57188815899;7102948451;54395638200;57193252080;57193234908;16178726600;","UV irradiation-assisted ethanol detection operated by the gas sensor based on ZnO nanowires/optical fiber hybrid structure",2017,"Sensors and Actuators, B: Chemical","245",,,"821","827",,76,"10.1016/j.snb.2017.01.187","https://www.scopus.com/inward/record.uri?eid=2-s2.0-85011957210&doi=10.1016%2fj.snb.2017.01.187&partnerID=40&md5=60b0bd44bb24685ba26f83c5994378b4",Article,"Final","All Open Access, Bronze",Scopus,2-s2.0-85011957210
"Zhan, Z., Liu, X., Li, H., Fan, M., Huang, C.","57008711600;36242104900;15034994500;58461324400;7406885094;","Facile synthesis of V2O3 nanobelts by the transformation of VO2(B) with controllable phase transition property",2016,"Materials Letters","165",,,"214","216",,4,"10.1016/j.matlet.2015.11.094","https://www.scopus.com/inward/record.uri?eid=2-s2.0-84950349547&doi=10.1016%2fj.matlet.2015.11.094&partnerID=40&md5=19eb6e5c2b2ab40eb2f720833d620fcb",Article,"Final","",Scopus,2-s2.0-84950349547
"Lee, S., Ivanov, I.N., Keum, J.K., Lee, H.N.","7601412423;22734441900;26642999400;8860807000;","Epitaxial stabilization and phase instability of VO 2 polymorphs",2016,"Scientific Reports","6",,"19621","","",,141,"10.1038/srep19621","https://www.scopus.com/inward/record.uri?eid=2-s2.0-84955583741&doi=10.1038%2fsrep19621&partnerID=40&md5=2592341e89b6422fdf7fd0a0594b917f",Article,"Final","All Open Access, Gold, Green",Scopus,2-s2.0-84955583741
"Liang, J., Li, W., Liu, J., Hu, M.","14829251000;57169156300;55705948600;34770221700;","Room temperature NO2sensing performance of free-standing mesh-structure vanadium dioxide nanorods by a chemical vapour deposition method",2016,"Journal of Alloys and Compounds","687",,,"845","854",,27,"10.1016/j.jallcom.2016.06.142","https://www.scopus.com/inward/record.uri?eid=2-s2.0-84976610166&doi=10.1016%2fj.jallcom.2016.06.142&partnerID=40&md5=413ef3bf922f38672ec28d5aa7d4cf0f",Article,"Final","",Scopus,2-s2.0-84976610166
"Sudalma, S., Purwanto, P., Santoso, L.W.","","The Effect of SO2 and NO2 from Transportation and Stationary Emissions Sources to SO42- and NO3- in Rain Water in Semarang",2015,"Procedia Environ. Sci.","23",,,"247","252",,43,,,Article,"Final","",Scopus,2-s2.0-84939250318
"Dai, Z., Lee, C.-S., Tian, Y., Kim, I.-D., Lee, J.-H.","37016057800;55626350100;58596232100;36037925300;26643283000;","Highly reversible switching from P- to N-type NO2 sensing in a monolayer Fe2O3 inverse opal film and the associated P-N transition phase diagram",2015,"Journal of Materials Chemistry A","3","7",,"3372","3381",,172,"10.1039/c4ta05438e","https://www.scopus.com/inward/record.uri?eid=2-s2.0-84922822442&doi=10.1039%2fc4ta05438e&partnerID=40&md5=af2b950e71716412cc81ec63179af961",Article,"Final","",Scopus,2-s2.0-84922822442
"Xu, H.F., Liu, Y., Wei, N., Jin, S.W.","55651233200;36013497800;57196348737;14625407700;","From VO2(B) to VO2(A) nanorods: Hydrothermal synthesis, evolution and optical properties in V2O5H2C2O4H2O system",2014,"Optik","125","20",,"6078","6081",,23,"10.1016/j.ijleo.2014.06.132","https://www.scopus.com/inward/record.uri?eid=2-s2.0-84912551855&doi=10.1016%2fj.ijleo.2014.06.132&partnerID=40&md5=f64667f2acd1c78c7c661c0122684c79",Article,"Final","",Scopus,2-s2.0-84912551855
"Simo, A., Mwakikunga, B., Sone, B.T., Julies, B., Madjoe, R., Maaza, M.","56091673900;23486100300;56092058900;6507181344;7801612337;7003476200;","VO2 nanostructures based chemiresistors for low power energy consumption hydrogen sensing",2014,"International Journal of Hydrogen Energy","39","15",,"8147","8157",,108,"10.1016/j.ijhydene.2014.03.037","https://www.scopus.com/inward/record.uri?eid=2-s2.0-84899908380&doi=10.1016%2fj.ijhydene.2014.03.037&partnerID=40&md5=92f808cc24dd022278b8d7127937aaf2",Article,"Final","",Scopus,2-s2.0-84899908380
