Authors,Author(s) ID,Title,Year,Source title,Volume,Issue,Art. No.,Page start,Page end,Page count,Cited by,DOI,Link,Document Type,Publication Stage,Open Access,Source,EID
"Xian-Quan, M., Xiao-Dan, W.U.","","Research on the Process of V2O3 Production from Ammonium Polyvanadate",2014,"Rare Metals and Cemented Carbides",,,,"","",,1,,,Article,"Final","",Scopus,2-s2.0-85182206983
"Qin, Y., Fan, G., Liu, K., Hu, M.","35211408500;55863409800;55863442700;34770221700;","Vanadium pentoxide hierarchical structure networks for high performance ethanol gas sensor with dual working temperature characteristic",2014,"Sensors and Actuators, B: Chemical","190",,,"141","148",,122,"10.1016/j.snb.2013.08.061","https://www.scopus.com/inward/record.uri?eid=2-s2.0-84884563145&doi=10.1016%2fj.snb.2013.08.061&partnerID=40&md5=84af39b6b20f5ddacd498f9087ed4df7",Article,"Final","",Scopus,2-s2.0-84884563145
"Liu, L., Yao, T., Tan, X., Liu, Q., Wang, Z., Shen, D., Sun, Z., Wei, S., Xie, Y.","59054408500;10340231500;53868473500;55628529782;57192243034;55570445600;8563779100;22964157500;7202268609;","Room-temperature intercalation-deintercalation strategy towards VO 2(B) single layers with atomic thickness",2012,"Small","8","24",,"3752","3756",,62,"10.1002/smll.201201552","https://www.scopus.com/inward/record.uri?eid=2-s2.0-84872909230&doi=10.1002%2fsmll.201201552&partnerID=40&md5=dd245075705cde9d0d829d6d2949720d",Article,"Final","",Scopus,2-s2.0-84872909230
"Yin, H., Yu, K., Zhang, Z., Zhu, Z.","42162393500;25635053500;35996197900;56224233900;","Morphology-control of VO 2 (B) nanostructures in hydrothermal synthesis and their field emission properties",2011,"Applied Surface Science","257","21",,"8840","8845",,46,"10.1016/j.apsusc.2011.04.079","https://www.scopus.com/inward/record.uri?eid=2-s2.0-79960177284&doi=10.1016%2fj.apsusc.2011.04.079&partnerID=40&md5=010210697aec0d25a1b6489116665eba",Article,"Final","",Scopus,2-s2.0-79960177284
"Vanalakar, S.A., Mali, S.S., Pawar, R.C., Tarwal, N.L., Moholkar, A.V., Kim, J.A., Kwon, Y.-B., Kim, J.H., Patil, P.S.","36638752500;35307610900;35318550200;26429017000;14822311700;57158967000;36163243600;55453169100;7201725330;","Synthesis of cadmium sulfide spongy balls with nanoconduits for effective light harvesting",2011,"Electrochimica Acta","56","6",,"2762","2768",,54,"10.1016/j.electacta.2010.12.080","https://www.scopus.com/inward/record.uri?eid=2-s2.0-79951578586&doi=10.1016%2fj.electacta.2010.12.080&partnerID=40&md5=989c49bd78d9a1d25ed7f5c51b9018d3",Article,"Final","",Scopus,2-s2.0-79951578586
"Conley, D.J., Paerl, H.W., Howarth, R.W., Boesch, D.F., Seitzinger, S.P., Havens, K.E., Lancelot, C., Likens, G.E.","7006462364;7006152830;7101808753;7004622302;7004252268;24289281200;7003602532;7006663244;","Ecology - Controlling eutrophication: Nitrogen and phosphorus",2009,"Science","323","5917",,"1014","1015",,3235,"10.1126/science.1167755","https://www.scopus.com/inward/record.uri?eid=2-s2.0-60749088668&doi=10.1126%2fscience.1167755&partnerID=40&md5=241299cca9369acf66aa9ce2de6e3eca",Short Survey,"Final","",Scopus,2-s2.0-60749088668
"Liu, J., Xue, D.","59064247300;55700497700;","Thermal oxidation strategy towards porous metal oxide hollow architectures",2008,"Advanced Materials","20","13",,"2622","2627",,336,"10.1002/adma.200800208","https://www.scopus.com/inward/record.uri?eid=2-s2.0-54949132137&doi=10.1002%2fadma.200800208&partnerID=40&md5=0bf5777b589b61fac881b946ba44bb6c",Article,"Final","",Scopus,2-s2.0-54949132137
"Wang, Y., Zhang, Z., Zhu, Y., Li, Z., Vajtai, R., Ci, L., Ajayan, P.M.","23986864800;8917458200;57198950457;55098602700;7003388970;7003951465;35492852400;","Nanostructured VO2 photocatalysts for hydrogen production",2008,"ACS Nano","2","7",,"1492","1496",,165,"10.1021/nn800223s","https://www.scopus.com/inward/record.uri?eid=2-s2.0-49249125022&doi=10.1021%2fnn800223s&partnerID=40&md5=54a29e7bb93275970286689a4a578e88",Article,"Final","",Scopus,2-s2.0-49249125022
"De, S., Dey, A., De, S.K.","26435074200;14058023500;26435074200;","Electrical transport and optical properties of vanadyl phosphate-polyaniline nanocomposites",2007,"Journal of Physics and Chemistry of Solids","68","1",,"66","72",,40,"10.1016/j.jpcs.2006.09.001","https://www.scopus.com/inward/record.uri?eid=2-s2.0-33845420441&doi=10.1016%2fj.jpcs.2006.09.001&partnerID=40&md5=f481c0916fd678dd253e596a66ec461b",Article,"Final","",Scopus,2-s2.0-33845420441
"De, S., Dey, A., De, S.K.","55052481500;8672315600;26435074200;","Characterization and transport properties of intercalated polypyrrole-vanadium pentoxide xerogel nanocomposite",2006,"Solid State Communications","137","12",,"662","667",,27,"10.1016/j.ssc.2006.01.027","https://www.scopus.com/inward/record.uri?eid=2-s2.0-33644762917&doi=10.1016%2fj.ssc.2006.01.027&partnerID=40&md5=e53f446d9e66fb67ad8ab2e6c736671b",Article,"Final","",Scopus,2-s2.0-33644762917
"Gharbi, N., Sanchez, C., Livage, J., Lemerle, J., Néjem, L., Lefebvre, J.","7004115411;7401448713;7004530492;15620705300;15620860100;15620214200;","Mixed-Valence Polyvanadic Acid Gels",1982,"Inorganic Chemistry","21","7",,"2758","2765",,157,"10.1021/ic00137a043","https://www.scopus.com/inward/record.uri?eid=2-s2.0-33845553436&doi=10.1021%2fic00137a043&partnerID=40&md5=5243b3f6d36b78b5e95b47ae4e8fa530",Article,"Final","",Scopus,2-s2.0-33845553436
