Authors,Author(s) ID,Title,Year,Source title,Volume,Issue,Art. No.,Page start,Page end,Page count,Cited by,DOI,Link,Document Type,Publication Stage,Open Access,Source,EID
"Mittal, A., Moorthy, A.K., Bovik, A.C.","36728155400;26427754300;56984291600;","Blind/referenceless image spatial quality evaluator",2011,"Conference Record - Asilomar Conference on Signals, Systems and Computers",,,"6190099","723","727",,281,"10.1109/ACSSC.2011.6190099","https://www.scopus.com/inward/record.uri?eid=2-s2.0-84861304270&doi=10.1109%2fACSSC.2011.6190099&partnerID=40&md5=deac4c40afc553941e8fe0c3bc514c5d",Conference Paper,"Final","All Open Access, Green",Scopus,2-s2.0-84861304270
"Horé, A., Ziou, D.","23135135100;7004105959;","Image quality metrics: PSNR vs. SSIM",2010,"Proceedings - International Conference on Pattern Recognition",,,"5596999","2366","2369",,3581,"10.1109/ICPR.2010.579","https://www.scopus.com/inward/record.uri?eid=2-s2.0-78149476646&doi=10.1109%2fICPR.2010.579&partnerID=40&md5=ef6d22c85997b15241f85f90f354a944",Conference Paper,"Final","",Scopus,2-s2.0-78149476646
"Paolacci, G., Chandler, J., Ipeirotis, P.G.","36499940900;7201941508;6603236863;","Running experiments on Amazon mechanical turk",2010,"Judgment and Decision Making","5","5",,"411","419",,3615,"10.1017/s1930297500002205","https://www.scopus.com/inward/record.uri?eid=2-s2.0-77957011930&doi=10.1017%2fs1930297500002205&partnerID=40&md5=ac34969273ddec533a13cc62b1685004",Article,"Final","All Open Access, Gold, Green",Scopus,2-s2.0-77957011930
"Tsao, D.Y., Livingstone, M.S.","7005078784;7005768399;","Mechanisms of face perception",2008,"Annual Review of Neuroscience","31",,,"411","437",,494,"10.1146/annurev.neuro.30.051606.094238","https://www.scopus.com/inward/record.uri?eid=2-s2.0-48249094613&doi=10.1146%2fannurev.neuro.30.051606.094238&partnerID=40&md5=e32585c39ac7be7a40a3c89ce012b359",Review,"Final","All Open Access, Green",Scopus,2-s2.0-48249094613
"Huynh-Thu, Q., Ghanbari, M.","12752819300;7006530936;","Scope of validity of PSNR in image/video quality assessment",2008,"Electronics Letters","44","13",,"800","801",,2124,"10.1049/el:20080522","https://www.scopus.com/inward/record.uri?eid=2-s2.0-45749130181&doi=10.1049%2fel%3a20080522&partnerID=40&md5=3cbeaaa2a89b8397e71902f8952a87f6",Article,"Final","",Scopus,2-s2.0-45749130181
"Hogg, R.V., McKean, J., Craig, A.T.","","Introduction to mathematical statistics",2005,"Introduction to Mathematical Statistics",,,,"","",,32,,,Article,"Final","",Scopus,2-s2.0-84969128228
"Kendall, M.G., Stuart, A.","",[No title available],2004,"The Advanced Theory of Statistics",,,,"","",,10596,,,Article,"Final","",Scopus,2-s2.0-0003686431
"Wang, Z., Bovik, A.C., Sheikh, H.R., Simoncelli, E.P.","55880038400;56984291600;7006576714;7004044833;","Image quality assessment: From error visibility to structural similarity",2004,"IEEE Transactions on Image Processing","13","4",,"600","612",,43470,"10.1109/TIP.2003.819861","https://www.scopus.com/inward/record.uri?eid=2-s2.0-1942436689&doi=10.1109%2fTIP.2003.819861&partnerID=40&md5=c5daf1e844ae994c5641935ce4d84b4c",Article,"Final","",Scopus,2-s2.0-1942436689
"Kanwisher, N., McDermott, J., Chun, M.M.","7007112379;7202518254;7202781220;","The fusiform face area: A module in human extrastriate cortex specialized for face perception",1997,"Journal of Neuroscience","17","11",,"4302","4311",,6172,"10.1523/jneurosci.17-11-04302.1997","https://www.scopus.com/inward/record.uri?eid=2-s2.0-0030911020&doi=10.1523%2fjneurosci.17-11-04302.1997&partnerID=40&md5=8f4a3afa3b99b22f77b6354467e450a2",Article,"Final","All Open Access, Hybrid Gold, Green",Scopus,2-s2.0-0030911020
"Farah, M.J., Levinson, K.L., Klein, K.L.","7103335773;6603622096;7201988597;","Face perception and within-category discrimination in prosopagnosia",1995,"Neuropsychologia","33","6",,"661","667,669-674",,210,"10.1016/0028-3932(95)00002-K","https://www.scopus.com/inward/record.uri?eid=2-s2.0-0029052142&doi=10.1016%2f0028-3932%2895%2900002-K&partnerID=40&md5=f2fdeb354266a889196765b1b25520af",Article,"Final","All Open Access, Hybrid Gold",Scopus,2-s2.0-0029052142
