Authors,Author(s) ID,Title,Year,Source title,Volume,Issue,Art. No.,Page start,Page end,Page count,Cited by,DOI,Link,Document Type,Publication Stage,Open Access,Source,EID
"Makhmudkhujaev, F., Hong, S., Kyu Park, I.","","Re-aging gan: Toward personalized face age transformation",2021,"IEEE/CVF ICCV",,,,"3908","3917",,7,,,Article,"Final","",Scopus,2-s2.0-85135481965
"Wang, X., Li, Y., Zhang, H., Shan, Y.","57195942631;55919537600;57864343600;57219761074;","Towards Real-World Blind Face Restoration with Generative Facial Prior",2021,"Proceedings of the IEEE Computer Society Conference on Computer Vision and Pattern Recognition",,,,"9164","9174",,309,"10.1109/CVPR46437.2021.00905","https://www.scopus.com/inward/record.uri?eid=2-s2.0-85123212518&doi=10.1109%2fCVPR46437.2021.00905&partnerID=40&md5=1062835d38ec9cca458f657ebbad9816",Conference Paper,"Final","All Open Access, Green",Scopus,2-s2.0-85123212518
"Ou, F.-Z., Chen, X., Zhang, R., Huang, Y., Li, S., Li, J., Li, Y., Cao, L., Wang, Y.-G.","57212479525;57222809748;57219767709;57219318244;41861678400;57196160894;57202365984;35749499000;16319945400;","SDD-FIQA: Unsupervised Face Image Quality Assessment with Similarity Distribution Distance",2021,"Proceedings of the IEEE Computer Society Conference on Computer Vision and Pattern Recognition",,,,"7666","7675",,93,"10.1109/CVPR46437.2021.00758","https://www.scopus.com/inward/record.uri?eid=2-s2.0-85123208474&doi=10.1109%2fCVPR46437.2021.00758&partnerID=40&md5=79009bc3bffcb7008391bcd960a1b343",Conference Paper,"Final","All Open Access, Green",Scopus,2-s2.0-85123208474
"Yang, T., Ren, P., Xie, X., Zhang, L.","57699449400;35771388800;57210375524;55115873800;","GaN Prior Embedded Network for Blind Face Restoration in the Wild",2021,"Proceedings of the IEEE Computer Society Conference on Computer Vision and Pattern Recognition",,,,"672","681",,221,"10.1109/CVPR46437.2021.00073","https://www.scopus.com/inward/record.uri?eid=2-s2.0-85122174696&doi=10.1109%2fCVPR46437.2021.00073&partnerID=40&md5=6685b10768ac63178a1c4b3d00dba923",Conference Paper,"Final","All Open Access, Green",Scopus,2-s2.0-85122174696
"Chen, C., Li, X., Yang, L., Lin, X., Zhang, L., Wong, K.-Y.K.","57203595932;57192498264;57210792225;57219788376;55115873800;57216110773;","Progressive semantic-aware style transformation for blind face restoration",2021,"Proceedings of the IEEE Computer Society Conference on Computer Vision and Pattern Recognition",,,,"11891","11900",,120,"10.1109/CVPR46437.2021.01172","https://www.scopus.com/inward/record.uri?eid=2-s2.0-85115273826&doi=10.1109%2fCVPR46437.2021.01172&partnerID=40&md5=e07ac9e65da073e6be0ee9798af0b462",Conference Paper,"Final","All Open Access, Green",Scopus,2-s2.0-85115273826
"Ding, K., Ma, K., Wang, S., Simoncelli, E.P.","","Image quality assessment: Unifying structure and texture similarity",2020,"Image quality assessment: Unifying structure and texture similarity",,,,"","",,44,,,Article,"Final","",Scopus,2-s2.0-85147657052
"Hernandez-Ortega, J., Galbally, J., Fierrez, J., Beslay, L.","",[No title available],2020,"Biometric Quality: Review and Application to Face Recognition with FaceQnet",,,,"","",,49,,,Article,"Final","",Scopus,2-s2.0-85098395997
"Yang, L., Wang, S., Ma, S., Gao, W., Liu, C., Wang, P., Ren, P.","57210792225;36645440900;34872761500;34770442400;57190496811;57211682635;35771388800;","HiFaceGAN: Face Renovation via Collaborative Suppression and Replenishment",2020,"MM 2020 - Proceedings of the 28th ACM International Conference on Multimedia",,,,"1551","1560",,91,"10.1145/3394171.3413965","https://www.scopus.com/inward/record.uri?eid=2-s2.0-85100399570&doi=10.1145%2f3394171.3413965&partnerID=40&md5=1eda1cafeda873be04e5a99fedc349cf",Conference Paper,"Final","All Open Access, Green",Scopus,2-s2.0-85100399570
"Kim, J., Kim, M., Kang, H., Lee, K.H.","57478151900;57221138166;57221137207;57216712366;","U-GAT-IT: UNSUPERVISED GENERATIVE ATTENTIONAL NETWORKS WITH ADAPTIVE LAYER-INSTANCE NORMALIZATION FOR IMAGE-TO-IMAGE TRANSLATION",2020,"8th International Conference on Learning Representations, ICLR 2020",,,,"","",,181,,"https://www.scopus.com/inward/record.uri?eid=2-s2.0-85126717511&partnerID=40&md5=0377b4bf60dec35698d236c9ec7a710f",Conference Paper,"Final","",Scopus,2-s2.0-85126717511
"Li, X., Chen, C., Zhou, S., Lin, X., Zuo, W., Zhang, L.","57192498264;57203595932;57192721201;57219788376;56888903800;55115873800;","Blind Face Restoration via Deep Multi-scale Component Dictionaries",2020,"Lecture Notes in Computer Science (including subseries Lecture Notes in Artificial Intelligence and Lecture Notes in Bioinformatics)","12354 LNCS",,,"399","415",,108,"10.1007/978-3-030-58545-7_23","https://www.scopus.com/inward/record.uri?eid=2-s2.0-85097108533&doi=10.1007%2f978-3-030-58545-7_23&partnerID=40&md5=1afe758bc8ab947d49011c577d250194",Conference Paper,"Final","All Open Access, Green",Scopus,2-s2.0-85097108533
"Zhang, Y., Tsang, I.W., Luo, Y., Hu, C.-H., Lu, X., Yu, X.","57201701049;7004570429;55766236300;55903374400;14627586600;57191429254;","Copy and Paste GAN: Face Hallucination from Shaded Thumbnails",2020,"Proceedings of the IEEE Computer Society Conference on Computer Vision and Pattern Recognition",,,"9156345","7353","7362",,29,"10.1109/CVPR42600.2020.00738","https://www.scopus.com/inward/record.uri?eid=2-s2.0-85094833733&doi=10.1109%2fCVPR42600.2020.00738&partnerID=40&md5=3e2de8defa78483e482977bfe8175ad8",Conference Paper,"Final","All Open Access, Green",Scopus,2-s2.0-85094833733
"Terhorst, P., Kolf, J.N., Damer, N., Kirchbuchner, F., Kuijper, A.","57194724290;57215743610;50861109400;57031859600;56131137100;","SER-FIQ: Unsupervised Estimation of Face Image Quality Based on Stochastic Embedding Robustness",2020,"Proceedings of the IEEE Computer Society Conference on Computer Vision and Pattern Recognition",,,"9156903","5650","5659",,150,"10.1109/CVPR42600.2020.00569","https://www.scopus.com/inward/record.uri?eid=2-s2.0-85094816301&doi=10.1109%2fCVPR42600.2020.00569&partnerID=40&md5=74a9894df06fe2347966c951ae81c21c",Conference Paper,"Final","All Open Access, Green",Scopus,2-s2.0-85094816301
"Wan, Z., Zhang, B., Chen, D., Zhang, P., Chen, D., Liao, J., Wen, F.","57218716977;57215034874;56564373400;58262907700;57937101800;36982929200;36549728200;","Bringing old photos back to life",2020,"Proceedings of the IEEE Computer Society Conference on Computer Vision and Pattern Recognition",,,"9156748","2744","2754",,179,"10.1109/CVPR42600.2020.00282","https://www.scopus.com/inward/record.uri?eid=2-s2.0-85094565711&doi=10.1109%2fCVPR42600.2020.00282&partnerID=40&md5=59a44479874d1db772427272f054f08c",Conference Paper,"Final","All Open Access, Green",Scopus,2-s2.0-85094565711
"Yoo, J., Ahn, N., Sohn, K.-A.","55823730300;57204289362;56043382200;","Rethinking data augmentation for image super-resolution: A comprehensive analysis and a new strategy",2020,"Proceedings of the IEEE Computer Society Conference on Computer Vision and Pattern Recognition",,,"9156551","8372","8381",,129,"10.1109/CVPR42600.2020.00840","https://www.scopus.com/inward/record.uri?eid=2-s2.0-85094324137&doi=10.1109%2fCVPR42600.2020.00840&partnerID=40&md5=e737fa181c9da18ab5e565433533a364",Conference Paper,"Final","All Open Access, Green",Scopus,2-s2.0-85094324137
"Choi, Y., Uh, Y., Yoo, J., Ha, J.-W.","57207765183;54785324800;55823730300;55430349200;","StarGAN v2: Diverse Image Synthesis for Multiple Domains",2020,"Proceedings of the IEEE Computer Society Conference on Computer Vision and Pattern Recognition",,,"9157662","8185","8194",,1223,"10.1109/CVPR42600.2020.00821","https://www.scopus.com/inward/record.uri?eid=2-s2.0-85094098501&doi=10.1109%2fCVPR42600.2020.00821&partnerID=40&md5=5525aa6331bb1f459f818d4fa7bf2d9f",Conference Paper,"Final","All Open Access, Green",Scopus,2-s2.0-85094098501
"Lee, C.-H., Liu, Z., Wu, L., Luo, P.","57205626807;56437024900;57217987626;57203040853;","MaskGAN: Towards Diverse and Interactive Facial Image Manipulation",2020,"Proceedings of the IEEE Computer Society Conference on Computer Vision and Pattern Recognition",,,"9157722","5548","5557",,741,"10.1109/CVPR42600.2020.00559","https://www.scopus.com/inward/record.uri?eid=2-s2.0-85093100763&doi=10.1109%2fCVPR42600.2020.00559&partnerID=40&md5=6176635acffc32b6722102a9d7f5e73e",Conference Paper,"Final","All Open Access, Green",Scopus,2-s2.0-85093100763
"Schonfeld, E., Schiele, B., Khoreva, A.","57214473141;55267534700;56406498500;","A U-net based discriminator for generative adversarial networks",2020,"Proceedings of the IEEE Computer Society Conference on Computer Vision and Pattern Recognition",,,"9157564","8204","8213",,240,"10.1109/CVPR42600.2020.00823","https://www.scopus.com/inward/record.uri?eid=2-s2.0-85090158452&doi=10.1109%2fCVPR42600.2020.00823&partnerID=40&md5=982639cfb22516874f21c9ca18df2a9b",Conference Paper,"Final","All Open Access, Green",Scopus,2-s2.0-85090158452
"Menon, S., Damian, A., Hu, S., Ravi, N., Rudin, C.","57205629861;59264018400;57205622403;57205633166;8850433600;","PULSE: Self-Supervised Photo Upsampling via Latent Space Exploration of Generative Models",2020,"Proceedings of the IEEE Computer Society Conference on Computer Vision and Pattern Recognition",,,"9157448","2434","2442",,395,"10.1109/CVPR42600.2020.00251","https://www.scopus.com/inward/record.uri?eid=2-s2.0-85089483470&doi=10.1109%2fCVPR42600.2020.00251&partnerID=40&md5=5e3553af1b38524eb6f2931f5d8c5119",Conference Paper,"Final","All Open Access, Green",Scopus,2-s2.0-85089483470
"Karras, T., Laine, S., Aittala, M., Hellsten, J., Lehtinen, J., Aila, T.","36022486900;13008308700;35104427100;57219494877;7005279290;56007617800;","Analyzing and improving the image quality of stylegan",2020,"Proceedings of the IEEE Computer Society Conference on Computer Vision and Pattern Recognition",,,"9156570","8107","8116",,3777,"10.1109/CVPR42600.2020.00813","https://www.scopus.com/inward/record.uri?eid=2-s2.0-85088146586&doi=10.1109%2fCVPR42600.2020.00813&partnerID=40&md5=3afd62f885aa09a4f04f2dd18329efc6",Conference Paper,"Final","All Open Access, Green",Scopus,2-s2.0-85088146586
"Hong, S., Ryu, J.","55655059800;55636362500;","Unsupervised Face Domain Transfer for Low-Resolution Face Recognition",2020,"IEEE Signal Processing Letters","27",,"8945345","156","160",,18,"10.1109/LSP.2019.2963001","https://www.scopus.com/inward/record.uri?eid=2-s2.0-85079085156&doi=10.1109%2fLSP.2019.2963001&partnerID=40&md5=d63a8f929b9f957155ec5ec69b31c0cf",Article,"Final","",Scopus,2-s2.0-85079085156
"Yun, S., Han, D., Chun, S., Oh, S.J., Choe, J., Yoo, Y.","55581546300;56122621300;57202322059;57189659529;59167162700;56047856200;","CutMix: Regularization strategy to train strong classifiers with localizable features",2019,"Proceedings of the IEEE International Conference on Computer Vision",,,"9008296","6022","6031",,3439,"10.1109/ICCV.2019.00612","https://www.scopus.com/inward/record.uri?eid=2-s2.0-85075506351&doi=10.1109%2fICCV.2019.00612&partnerID=40&md5=d110b4ea3f2ed10a2ebbceb4897c4801",Conference Paper,"Final","All Open Access, Green",Scopus,2-s2.0-85075506351
"Hernandez-Ortega, J., Galbally, J., Fierrez, J., Haraksim, R., Beslay, L.","57193213963;22034244200;55664171900;35198028000;56462946900;","FaceQnet: Quality Assessment for Face Recognition based on Deep Learning",2019,"2019 International Conference on Biometrics, ICB 2019",,,"8987255","","",,128,"10.1109/ICB45273.2019.8987255","https://www.scopus.com/inward/record.uri?eid=2-s2.0-85081067952&doi=10.1109%2fICB45273.2019.8987255&partnerID=40&md5=e338804d267630e4083489a9ffa39402",Conference Paper,"Final","All Open Access, Green",Scopus,2-s2.0-85081067952
"Karras, T., Laine, S., Aila, T.","36022486900;13008308700;56007617800;","A style-based generator architecture for generative adversarial networks",2019,"Proceedings of the IEEE Computer Society Conference on Computer Vision and Pattern Recognition","2019-June",,"8953766","4396","4405",,6402,"10.1109/CVPR.2019.00453","https://www.scopus.com/inward/record.uri?eid=2-s2.0-85078812810&doi=10.1109%2fCVPR.2019.00453&partnerID=40&md5=9aeb049d5da74f7a52f7d29ac38e27dd",Conference Paper,"Final","All Open Access, Green",Scopus,2-s2.0-85078812810
"Deng, J., Guo, J., Xue, N., Zafeiriou, S.","56514437400;57214940128;57200519067;8883680000;","ArcFace: Additive angular margin loss for deep face recognition",2019,"Proceedings of the IEEE Computer Society Conference on Computer Vision and Pattern Recognition","2019-June",,"8953658","4685","4694",,4451,"10.1109/CVPR.2019.00482","https://www.scopus.com/inward/record.uri?eid=2-s2.0-85078775898&doi=10.1109%2fCVPR.2019.00482&partnerID=40&md5=d1413dacc57486e8b29e881ec6b17010",Conference Paper,"Final","All Open Access, Green",Scopus,2-s2.0-85078775898
"Im, W., Hong, S., Yoon, S.-E., Yang, H.S.","57195611715;55655059800;7404036142;57201282778;","Scale-varying triplet ranking with classification loss for facial age estimation",2019,"Lecture Notes in Computer Science (including subseries Lecture Notes in Artificial Intelligence and Lecture Notes in Bioinformatics)","11365 LNCS",,,"247","259",,10,"10.1007/978-3-030-20873-8_16","https://www.scopus.com/inward/record.uri?eid=2-s2.0-85066792257&doi=10.1007%2f978-3-030-20873-8_16&partnerID=40&md5=a8af06c9150395c39871502ec35b502d",Conference Paper,"Final","",Scopus,2-s2.0-85066792257
"Haris, M., Shakhnarovich, G., Ukita, N.","56285545200;6507166713;55901244300;","Deep Back-Projection Networks for Super-Resolution",2018,"Proceedings of the IEEE Computer Society Conference on Computer Vision and Pattern Recognition",,,"8578277","1664","1673",,1400,"10.1109/CVPR.2018.00179","https://www.scopus.com/inward/record.uri?eid=2-s2.0-85062244269&doi=10.1109%2fCVPR.2018.00179&partnerID=40&md5=a89c6b2e53bb3c7bcb7fb47dcea40175",Conference Paper,"Final","All Open Access, Green",Scopus,2-s2.0-85062244269
"Blau, Y., Michaeli, T.","56381515000;18042574300;","The Perception-Distortion Tradeoff",2018,"Proceedings of the IEEE Computer Society Conference on Computer Vision and Pattern Recognition",,,"8578750","6228","6237",,603,"10.1109/CVPR.2018.00652","https://www.scopus.com/inward/record.uri?eid=2-s2.0-85061745992&doi=10.1109%2fCVPR.2018.00652&partnerID=40&md5=18460ab2688e16a04c84615214246186",Conference Paper,"Final","All Open Access, Green",Scopus,2-s2.0-85061745992
"Zhang, R., Isola, P., Efros, A.A., Shechtman, E., Wang, O.","57223101349;50561507500;7005029942;55924548800;24170210400;","The Unreasonable Effectiveness of Deep Features as a Perceptual Metric",2018,"Proceedings of the IEEE Computer Society Conference on Computer Vision and Pattern Recognition",,,"8578166","586","595",,7467,"10.1109/CVPR.2018.00068","https://www.scopus.com/inward/record.uri?eid=2-s2.0-85061738954&doi=10.1109%2fCVPR.2018.00068&partnerID=40&md5=a4dba81ea970c4ea324bf9953dad1c9d",Conference Paper,"Final","All Open Access, Green",Scopus,2-s2.0-85061738954
"Wang, X., Yu, K., Dong, C., Change Loy, C.","57195942631;57195941109;59157675500;25522308800;","Recovering Realistic Texture in Image Super-Resolution by Deep Spatial Feature Transform",2018,"Proceedings of the IEEE Computer Society Conference on Computer Vision and Pattern Recognition",,,"8578168","606","615",,896,"10.1109/CVPR.2018.00070","https://www.scopus.com/inward/record.uri?eid=2-s2.0-85061709952&doi=10.1109%2fCVPR.2018.00070&partnerID=40&md5=c0aaa1fac7afd3280c7b32298294b787",Conference Paper,"Final","All Open Access, Green",Scopus,2-s2.0-85061709952
"Cao, Q., Shen, L., Xie, W., Parkhi, O.M., Zisserman, A.","57655458600;55922686900;57192403839;54956597300;7006619672;","VGGFace2: A dataset for recognising faces across pose and age",2018,"Proceedings - 13th IEEE International Conference on Automatic Face and Gesture Recognition, FG 2018",,,,"67","74",,2078,"10.1109/FG.2018.00020","https://www.scopus.com/inward/record.uri?eid=2-s2.0-85049388271&doi=10.1109%2fFG.2018.00020&partnerID=40&md5=440ff62e93542c31f978eeb17c232b84",Conference Paper,"Final","All Open Access, Green",Scopus,2-s2.0-85049388271
"Li, X., Liu, M., Ye, Y., Zuo, W., Lin, L., Yang, R.","","Learning warped guidance for blind face restoration",2018,"European Conference on Computer Vision",,,,"272","289",,370,,,Article,"Final","",Scopus,2-s2.0-85075062687
"Karras, T., Aila, T., Laine, S., Lehtinen, J.","36022486900;56007617800;13008308700;7005279290;","Progressive growing of GANs for improved quality, stability, and variation",2018,"6th International Conference on Learning Representations, ICLR 2018 - Conference Track Proceedings",,,,"","",,2568,,"https://www.scopus.com/inward/record.uri?eid=2-s2.0-85083950495&partnerID=40&md5=677460cc067e1492cf8b4b5a7a966832",Conference Paper,"Final","",Scopus,2-s2.0-85083950495
"Zhang, Y., Li, K., Li, K., Wang, L., Zhong, B., Fu, Y.","56928496400;56493516900;57222222589;57203928134;24473810700;7404432812;","Image super-resolution using very deep residual channel attention networks",2018,"Lecture Notes in Computer Science (including subseries Lecture Notes in Artificial Intelligence and Lecture Notes in Bioinformatics)","11211 LNCS",,,"294","310",,1069,"10.1007/978-3-030-01234-2_18","https://www.scopus.com/inward/record.uri?eid=2-s2.0-85055092808&doi=10.1007%2f978-3-030-01234-2_18&partnerID=40&md5=98f30d0159db9ff462227ae4e6aa3941",Conference Paper,"Final","",Scopus,2-s2.0-85055092808
"Bulat, A., Tzimiropoulos, G.","57191432700;18042589100;","How Far are We from Solving the 2D &amp; 3D Face Alignment Problem? (and a Dataset of 230,000 3D Facial Landmarks)",2017,"Proceedings of the IEEE International Conference on Computer Vision","2017-October",,"8237378","1021","1030",,1206,"10.1109/ICCV.2017.116","https://www.scopus.com/inward/record.uri?eid=2-s2.0-85041925917&doi=10.1109%2fICCV.2017.116&partnerID=40&md5=809d52efbf63b4180170b49c3e8ca160",Conference Paper,"Final","All Open Access, Green",Scopus,2-s2.0-85041925917
"Mao, X., Li, Q., Xie, H., Lau, R.Y.K., Wang, Z., Smolley, S.P.","54883408900;56190105400;57219619828;12794272900;57192377511;57200620239;","Least Squares Generative Adversarial Networks",2017,"Proceedings of the IEEE International Conference on Computer Vision","2017-October",,"8237566","2813","2821",,3446,"10.1109/ICCV.2017.304","https://www.scopus.com/inward/record.uri?eid=2-s2.0-85041908569&doi=10.1109%2fICCV.2017.304&partnerID=40&md5=fa209f8997bb52839f6b5fbc9e39c189",Conference Paper,"Final","All Open Access, Green",Scopus,2-s2.0-85041908569
"He, K., Gkioxari, G., Dollar, P., Girshick, R.","57209052101;55922650600;15622876800;35179333300;","Mask R-CNN",2017,"Proceedings of the IEEE International Conference on Computer Vision","2017-October",,"8237584","2980","2988",,19557,"10.1109/ICCV.2017.322","https://www.scopus.com/inward/record.uri?eid=2-s2.0-85040313738&doi=10.1109%2fICCV.2017.322&partnerID=40&md5=ec54a6e3213e19d0e80a918920697dc5",Conference Paper,"Final","",Scopus,2-s2.0-85040313738
"Chen, L.-C., Papandreou, G., Schroff, F., Adam, H.","","Rethinking Atrous Convolution for Semantic Image Segmentation",2017,"Rethinking Atrous Convolution for Semantic Image Segmentation",,,,"","",,7316,,,Article,"Final","",Scopus,2-s2.0-85041907099
"DeVries, T., Taylor, G.W.","",[No title available],2017,"Improved Regularization of Convolutional Neural Networks with Cutout",,,,"","",,2742,,,Article,"Final","",Scopus,2-s2.0-85054870792
"Heusel, M., Ramsauer, H., Unterthiner, T., Nessler, B., Hochreiter, S.","18634268400;57202054316;37078167900;36117883500;6602873810;","GANs trained by a two time-scale update rule converge to a local Nash equilibrium",2017,"Advances in Neural Information Processing Systems","2017-December",,,"6627","6638",,7694,,"https://www.scopus.com/inward/record.uri?eid=2-s2.0-85041020882&partnerID=40&md5=9727b27f3aeef4b9daa0e2ef6515a030",Conference Paper,"Final","",Scopus,2-s2.0-85041020882
"He, K., Zhang, X., Ren, S., Sun, J.","57209052101;58619489100;56333537300;56333360900;","Deep residual learning for image recognition",2016,"Proceedings of the IEEE Computer Society Conference on Computer Vision and Pattern Recognition","2016-December",,"7780459","770","778",,166824,"10.1109/CVPR.2016.90","https://www.scopus.com/inward/record.uri?eid=2-s2.0-84986274465&doi=10.1109%2fCVPR.2016.90&partnerID=40&md5=f67e8d2a623bac88aad535d2c0a6d374",Conference Paper,"Final","All Open Access, Green",Scopus,2-s2.0-84986274465
"Laparra, V., Balle, J., Berardino, A., Simoncelii, E.P.","34869963500;32867460000;57193131162;7004044833;","Perceptual image quality assessment using a normalized Laplacian pyramid",2016,"Human Vision and Electronic Imaging 2016, HVEI 2016",,,,"43","48",,49,"10.2352/ISSN.2470-1173.2016.16HVEI-103","https://www.scopus.com/inward/record.uri?eid=2-s2.0-85011092689&doi=10.2352%2fISSN.2470-1173.2016.16HVEI-103&partnerID=40&md5=884bbac7e31485dd0008c1136803df59",Conference Paper,"Final","",Scopus,2-s2.0-85011092689
"Johnson, J., Alahi, A., Fei-Fei, L.","57141179400;34869135400;8952942000;","Perceptual losses for real-time style transfer and super-resolution",2016,"Lecture Notes in Computer Science (including subseries Lecture Notes in Artificial Intelligence and Lecture Notes in Bioinformatics)","9906 LNCS",,,"694","711",,7151,"10.1007/978-3-319-46475-6_43","https://www.scopus.com/inward/record.uri?eid=2-s2.0-84990854047&doi=10.1007%2f978-3-319-46475-6_43&partnerID=40&md5=f1f178951a85c46382daba3d4e1c3e8a",Conference Paper,"Final","",Scopus,2-s2.0-84990854047
"Yu, X., Porikli, F.","57191429254;6603528219;","Ultra-resolving face images by discriminative generative networks",2016,"Lecture Notes in Computer Science (including subseries Lecture Notes in Artificial Intelligence and Lecture Notes in Bioinformatics)","9909 LNCS",,,"318","333",,230,"10.1007/978-3-319-46454-1_20","https://www.scopus.com/inward/record.uri?eid=2-s2.0-84990052453&doi=10.1007%2f978-3-319-46454-1_20&partnerID=40&md5=3767de492a70699d39a238965173dbab",Conference Paper,"Final","All Open Access, Bronze",Scopus,2-s2.0-84990052453
"Zhu, S., Liu, S., Loy, C.C., Tang, X.","57141236900;55923631700;25522308800;7404101198;","Deep cascaded Bi-network for face hallucination",2016,"Lecture Notes in Computer Science (including subseries Lecture Notes in Artificial Intelligence and Lecture Notes in Bioinformatics)","9909 LNCS",,,"614","630",,182,"10.1007/978-3-319-46454-1_37","https://www.scopus.com/inward/record.uri?eid=2-s2.0-84990050338&doi=10.1007%2f978-3-319-46454-1_37&partnerID=40&md5=ba595e0174b492464257eb23f8615801",Conference Paper,"Final","All Open Access, Bronze",Scopus,2-s2.0-84990050338
"Russakovsky, O., Deng, J., Su, H., Krause, J., Satheesh, S., Ma, S., Huang, Z., Karpathy, A., Khosla, A., Bernstein, M., Berg, A.C., Fei-Fei, L.","36352471800;36617097900;55208624800;55366384300;35753739700;56589315500;57189092681;47962274400;36135822500;57193014048;36099870600;8952942000;","ImageNet Large Scale Visual Recognition Challenge",2015,"International Journal of Computer Vision","115","3",,"211","252",,29600,"10.1007/s11263-015-0816-y","https://www.scopus.com/inward/record.uri?eid=2-s2.0-84947041871&doi=10.1007%2fs11263-015-0816-y&partnerID=40&md5=ba4833102503cf8586d4f777f98ea99e",Article,"Final","",Scopus,2-s2.0-84947041871
"Simonyan, K., Zisserman, A.","34870482800;7006619672;","Very deep convolutional networks for large-scale image recognition",2015,"3rd International Conference on Learning Representations, ICLR 2015 - Conference Track Proceedings",,,,"","",,27260,,"https://www.scopus.com/inward/record.uri?eid=2-s2.0-85083953063&partnerID=40&md5=a5b2d6b3fc9f0a6f92864467079a1280",Conference Paper,"Final","",Scopus,2-s2.0-85083953063
"Ronneberger, O., Fischer, P., Brox, T.","6505888134;56405943000;8867345000;","U-net: Convolutional networks for biomedical image segmentation",2015,"Lecture Notes in Computer Science (including subseries Lecture Notes in Artificial Intelligence and Lecture Notes in Bioinformatics)","9351",,,"234","241",,61862,"10.1007/978-3-319-24574-4_28","https://www.scopus.com/inward/record.uri?eid=2-s2.0-84951834022&doi=10.1007%2f978-3-319-24574-4_28&partnerID=40&md5=de947941e4f4a2d7509d68f7da31c08f",Conference Paper,"Final","",Scopus,2-s2.0-84951834022
"Goodfellow, I.J., Pouget-Abadie, J., Mirza, M., Xu, B., Warde-Farley, D., Ozair, S., Courville, A., Bengio, Y.","35956088800;56736268100;55431127900;56024082600;24472176000;56354673800;6507291186;7003958245;","Generative adversarial nets",2014,"Advances in Neural Information Processing Systems","3","January",,"2672","2680",,46047,,"https://www.scopus.com/inward/record.uri?eid=2-s2.0-84937849144&partnerID=40&md5=6441b2a288c5fdded2adbcc8b21e092c",Conference Paper,"Final","",Scopus,2-s2.0-84937849144
"Lin, T.-Y., Maire, M., Belongie, S., Hays, J., Perona, P., Ramanan, D., Dollár, P., Zitnick, C.L.","55268148900;7003906267;6603376681;7102191400;7006384933;6506835622;15622876800;6506184188;","Microsoft COCO: Common objects in context",2014,"Lecture Notes in Computer Science (including subseries Lecture Notes in Artificial Intelligence and Lecture Notes in Bioinformatics)","8693 LNCS","PART 5",,"740","755",,27406,"10.1007/978-3-319-10602-1_48","https://www.scopus.com/inward/record.uri?eid=2-s2.0-84906493406&doi=10.1007%2f978-3-319-10602-1_48&partnerID=40&md5=cc173698bd61ec02e89bcb8346f3b5eb",Conference Paper,"Final","All Open Access, Bronze",Scopus,2-s2.0-84906493406
"Mittal, A., Soundararajan, R., Bovik, A.C.","36728155400;24774190800;56984291600;","Making a 'completely blind' image quality analyzer",2013,"IEEE Signal Processing Letters","20","3","6353522","209","212",,4708,"10.1109/LSP.2012.2227726","https://www.scopus.com/inward/record.uri?eid=2-s2.0-84873400956&doi=10.1109%2fLSP.2012.2227726&partnerID=40&md5=6c351bbd6f879412c66269107fb33c2f",Article,"Final","",Scopus,2-s2.0-84873400956
