Authors,Author(s) ID,Title,Year,Source title,Volume,Issue,Art. No.,Page start,Page end,Page count,Cited by,DOI,Link,Document Type,Publication Stage,Open Access,Source,EID
"Wang, Z., Simoncelli, E.P.","","Reduced-reference image quality assessment using a wavelet-domain natural image statistic model",2005,"Human Vision and Electronic Imaging X Conference","5666",,,"149","159",,19,,,Article,"Final","",Scopus,2-s2.0-33645508295
"Wang, Z., Bovik, A.C., Sheikh, H.R., Simoncelli, E.P.","55880038400;56984291600;7006576714;7004044833;","Image quality assessment: From error visibility to structural similarity",2004,"IEEE Transactions on Image Processing","13","4",,"600","612",,43470,"10.1109/TIP.2003.819861","https://www.scopus.com/inward/record.uri?eid=2-s2.0-1942436689&doi=10.1109%2fTIP.2003.819861&partnerID=40&md5=c5daf1e844ae994c5641935ce4d84b4c",Article,"Final","",Scopus,2-s2.0-1942436689
"Wang, Z., Simoncelli, E.P., Bovik, A.C.","55880038400;7004044833;56984291600;","Multi-scale structural similarity for image quality assessment",2003,"Conference Record of the Asilomar Conference on Signals, Systems and Computers","2",,,"1398","1402",,5493,,"https://www.scopus.com/inward/record.uri?eid=2-s2.0-4143089652&partnerID=40&md5=6beeb85243bf7e2ea93211638a19a92a",Conference Paper,"Final","",Scopus,2-s2.0-4143089652
"Spearman, C.","","The proof and measurement of association between two things",1904,"American Journal of Psychology","15",,,"72","101",,6009,,,Article,"Final","",Scopus,2-s2.0-0002965815
"Pearson, K.","","Mathematical contributions to the theory of evolution. III. Regression, heredity and panmixia",1896,"Phil. Trans. R. Soc. Lond. A","187",,,"253","318",,1316,,,Article,"Final","",Scopus,2-s2.0-0000629279
