Authors,Author(s) ID,Title,Year,Source title,Volume,Issue,Art. No.,Page start,Page end,Page count,Cited by,DOI,Link,Document Type,Publication Stage,Open Access,Source,EID
"Kitchen, N.R., Sudduth, K.A., Drummond, S.T.","7005286742;7003394615;7006621888;","Soil electrical conductivity as a crop productivity measure for claypan soils",1999,"Journal of Production Agriculture","12","4",,"607","617",,244,"10.2134/jpa1999.0607","https://www.scopus.com/inward/record.uri?eid=2-s2.0-0033383622&doi=10.2134%2fjpa1999.0607&partnerID=40&md5=a19d73c9390343b7a783065c8b5cf1a9",Article,"Final","",Scopus,2-s2.0-0033383622
"Hearst, M.A.","","Support vector machines",1998,"IEEE Intelligent Systems","13","4",,"18","28",,4052,,,Article,"Final","",Scopus,2-s2.0-0003074296
"Gunn, S.","","Support vector machines for classification and regression",1998,"Support Vector Machines for Classification and Regression",,,,"","",,2801,,,Article,"Final","",Scopus,2-s2.0-0003425664
"Bishop, C.M.","",[No title available],1995,"Neural Networks for Pattern Recognition",,,,"","",,19997,,,Article,"Final","",Scopus,2-s2.0-0003487601
"Drummond, S.T., Sudduth, K.A., Birrell, S.J.","","Analysis and correlation methods for spatial data",1995,"Analysis and Correlation Methods for Spatial Data",,,,"","",,18,,,Article,"Final","",Scopus,2-s2.0-2642687872
"Kohavi, R.","56355116300;","A Study of Cross-Validation and Bootstrap for Accuracy Estimation and Model Selection",1995,"IJCAI International Joint Conference on Artificial Intelligence","2",,,"1137","1143",,9304,,"https://www.scopus.com/inward/record.uri?eid=2-s2.0-85164392958&partnerID=40&md5=d1a8da249a6a7acb600dc75c200de257",Conference Paper,"Final","",Scopus,2-s2.0-85164392958
"Krogh, A., Vedelsby, J.","57205707402;58203692300;","Neural Network Ensembles, Cross Validation, and Active Learning",1994,"NIPS 1994: Proceedings of the 7th International Conference on Neural Information Processing Systems",,,,"231","238",,1474,,"https://www.scopus.com/inward/record.uri?eid=2-s2.0-85054435084&partnerID=40&md5=23755b4f5b37a5c41696092638734c19",Conference Paper,"Final","",Scopus,2-s2.0-85054435084
"Wolpert, D.H.","7006620754;","Stacked generalization",1992,"Neural Networks","5","2",,"241","259",,5844,"10.1016/S0893-6080(05)80023-1","https://www.scopus.com/inward/record.uri?eid=2-s2.0-0026692226&doi=10.1016%2fS0893-6080%2805%2980023-1&partnerID=40&md5=1b507c100ad8744db25ea83249c00f6e",Article,"Final","",Scopus,2-s2.0-0026692226
"Aha, D.W., Kibler, D., Albert, M.K.","6701853513;56287165400;55415028200;","Instance-Based Learning Algorithms",1991,"Machine Learning","6","1",,"37","66",,4129,"10.1023/A:1022689900470","https://www.scopus.com/inward/record.uri?eid=2-s2.0-0025725905&doi=10.1023%2fA%3a1022689900470&partnerID=40&md5=833756f6b464c3f7068e416e423e50e9",Article,"Final","All Open Access, Bronze",Scopus,2-s2.0-0025725905
"McCullagh, P., Nelder, J.A.","",[No title available],1989,"Generalized Linear Models",,,,"","",,24844,,,Article,"Final","",Scopus,2-s2.0-0003663926
"Nelder, J.A., Wedderburn, R.W.M.","","Generalized linear models",1972,"Journal of the Royal Statistical Society A","135",,,"370","384",,5254,,,Article,"Final","",Scopus,2-s2.0-0001414179
"Trehan, D.","",[No title available],0000,"Why Choose Random Forest and Not Decision Trees",,,,"","",,5,,,Article,"Final","",Scopus,2-s2.0-85114208724
