Authors,Author(s) ID,Title,Year,Source title,Volume,Issue,Art. No.,Page start,Page end,Page count,Cited by,DOI,Link,Document Type,Publication Stage,Open Access,Source,EID
"Sun, S., Jiang, J., Qiu, L., Pang, S., Li, J., Liu, C., Wang, L., Xue, M., Ma, J.","57190495701;57204291365;8707128300;57204309336;56970072200;56746845500;57191035312;53985895800;56873526100;","Activation of ferrate by carbon nanotube for enhanced degradation of bromophenols: Kinetics, products, and involvement of Fe(V)/Fe(IV)",2019,"Water Research","156",,,"1","8",,118,"10.1016/j.watres.2019.02.057","https://www.scopus.com/inward/record.uri?eid=2-s2.0-85063259239&doi=10.1016%2fj.watres.2019.02.057&partnerID=40&md5=c6e84815c81246dd857b68fe89f8bbb0",Article,"Final","",Scopus,2-s2.0-85063259239
"Bakandritsos, A., Kadam, R.G., Kumar, P., Zoppellaro, G., Medved', M., Tuček, J., Montini, T., Tomanec, O., Andrýsková, P., Drahoš, B., Varma, R.S., Otyepka, M., Gawande, M.B., Fornasiero, P., Zbořil, R.","57202770362;57193868369;57192194417;7801441079;8523849200;8977068600;57208479381;15077582000;57204921936;25824218500;7201793587;57203216278;8921568100;7003709305;6602583148;","Mixed-Valence Single-Atom Catalyst Derived from Functionalized Graphene",2019,"Advanced Materials","31","17","1900323","","",,163,"10.1002/adma.201900323","https://www.scopus.com/inward/record.uri?eid=2-s2.0-85062321283&doi=10.1002%2fadma.201900323&partnerID=40&md5=76f860a10c843f6e02b6b8dd69a72177",Article,"Final","All Open Access, Hybrid Gold",Scopus,2-s2.0-85062321283
"Feng, Y., Qing, W., Kong, L., Li, H., Wu, D., Fan, Y., Lee, P.-H., Shih, K.","56707848900;55375590700;55508893400;57199325569;57195622842;56732210100;35148135600;14072108900;","Factors and mechanisms that influence the reactivity of trivalent copper: A novel oxidant for selective degradation of antibiotics",2019,"Water Research","149",,,"1","8",,86,"10.1016/j.watres.2018.10.090","https://www.scopus.com/inward/record.uri?eid=2-s2.0-85056170863&doi=10.1016%2fj.watres.2018.10.090&partnerID=40&md5=4c695ef3f75658d2537735d2e7a180b8",Article,"Final","",Scopus,2-s2.0-85056170863
"Wen, G., Lee, D.U., Ren, B., Hassan, F.M., Jiang, G., Cano, Z.P., Gostick, J., Croiset, E., Bai, Z., Yang, L., Chen, Z.","57193848601;59048099100;57193844205;26040726600;54420329100;56026160000;6507302334;56212362000;25630221200;37047701400;35279457000;","Orbital Interactions in Bi-Sn Bimetallic Electrocatalysts for Highly Selective Electrochemical CO2 Reduction toward Formate Production",2018,"Advanced Energy Materials","8","31","1802427","","",,349,"10.1002/aenm.201802427","https://www.scopus.com/inward/record.uri?eid=2-s2.0-85053669862&doi=10.1002%2faenm.201802427&partnerID=40&md5=01f589abd20600459cda9aad13e7b8d4",Article,"Final","",Scopus,2-s2.0-85053669862
"Hu, P., Su, H., Chen, Z., Yu, C., Li, Q., Zhou, B., Alvarez, P.J.J., Long, M.","55941057900;57191749489;57195987881;55638341800;7405861214;7401906755;7102962790;12753375600;","Selective Degradation of Organic Pollutants Using an Efficient Metal-Free Catalyst Derived from Carbonized Polypyrrole via Peroxymonosulfate Activation",2017,"Environmental Science and Technology","51","19",,"11288","11296",,579,"10.1021/acs.est.7b03014","https://www.scopus.com/inward/record.uri?eid=2-s2.0-85030666912&doi=10.1021%2facs.est.7b03014&partnerID=40&md5=9a3e99e29c44d5dfcbda08c4e72c8842",Article,"Final","",Scopus,2-s2.0-85030666912
"Guan, C., Jiang, J., Pang, S., Luo, C., Ma, J., Zhou, Y., Yang, Y.","57188715803;55731817100;24481549600;56421125700;56873526100;55990635600;57201951025;","Oxidation Kinetics of Bromophenols by Nonradical Activation of Peroxydisulfate in the Presence of Carbon Nanotube and Formation of Brominated Polymeric Products",2017,"Environmental Science and Technology","51","18",,"10718","10728",,196,"10.1021/acs.est.7b02271","https://www.scopus.com/inward/record.uri?eid=2-s2.0-85029685679&doi=10.1021%2facs.est.7b02271&partnerID=40&md5=f7686ed66442b9ab214af83456bdc446",Article,"Final","",Scopus,2-s2.0-85029685679
"Zhang, T., Chen, Y., Wang, Y., Le Roux, J., Yang, Y., Croué, J.-P.","56508623500;59075643100;56169066600;37077319700;56081933700;35588968700;","Efficient peroxydisulfate activation process not relying on sulfate radical generation for water pollutant degradation",2014,"Environmental Science and Technology","48","10",,"5868","5875",,694,"10.1021/es501218f","https://www.scopus.com/inward/record.uri?eid=2-s2.0-84901036361&doi=10.1021%2fes501218f&partnerID=40&md5=74b8d6cce390f14543ef234bede840e8",Article,"Final","All Open Access, Green",Scopus,2-s2.0-84901036361
"Tratnyek, P.G., Holgné, J.","7004041270;6505918405;","Oxidation of Substituted Phenols in the Environment: A QSAR Analysis of Rate Constants for Reaction with Singlet Oxygen",1991,"Environmental Science and Technology","25","9",,"1596","1604",,287,"10.1021/es00021a011","https://www.scopus.com/inward/record.uri?eid=2-s2.0-0025813240&doi=10.1021%2fes00021a011&partnerID=40&md5=813200c6618d6a13523443d6c038296c",Article,"Final","",Scopus,2-s2.0-0025813240
